id,question,answer,category,tags,alt_questions
nh_m_mi_ng_nhai_qa_01,"Nhóm sâu miệng nhai nên dùng thuốc gì và liều lượng bao nhiêu để đạt hiệu quả cao?","Nhóm sâu miệng nhai nên sử dụng thuốc Oxatin với liều lượng 30-40ml pha trong 25L nước. Công thức này cho hiệu quả phòng trừ sâu hại trên 90%, giúp bảo vệ cây trồng hiệu quả.","phac_do_mieng_nhai","mieng_nhai|oxatin|lieu_luong|phong_tru_sau_hai","Dùng thuốc gì để phòng trừ sâu miệng nhai hiệu quả?|Liều lượng Oxatin để diệt sâu miệng nhai là bao nhiêu?|Cách pha Oxatin để phòng trừ sâu miệng nhai?"
nh_m_mi_ng_nhai_qa_02,"Có thể thay thế Oxatin bằng thuốc nào khác khi phòng trừ nhóm sâu miệng nhai không?","Thông tin hiện tại chỉ khuyến cáo sử dụng Oxatin với liều lượng 30-40ml/25L nước cho nhóm sâu miệng nhai. Việc thay thế thuốc cần tham khảo thêm hướng dẫn chuyên môn hoặc khuyến cáo từ nhà sản xuất để đảm bảo hiệu quả và an toàn.","phac_do_mieng_nhai","mieng_nhai|oxatin|thay_the_thuoc|phong_tru_sau_hai","Có thể thay Oxatin bằng thuốc khác để diệt sâu miệng nhai không?|Lựa chọn thuốc thay thế Oxatin cho nhóm sâu miệng nhai?|Khuyến cáo khi thay thuốc phòng trừ sâu miệng nhai?"
nh_m_mi_ng_nhai_qa_03,"Tại sao nên sử dụng Oxatin với liều lượng 30-40ml/25L nước để phòng trừ sâu miệng nhai?","Sử dụng Oxatin với liều lượng 30-40ml pha trong 25L nước giúp đạt hiệu quả phòng trừ sâu miệng nhai trên 90%. Liều lượng này đảm bảo thuốc phát huy tối đa tác dụng diệt sâu, đồng thời hạn chế ảnh hưởng tiêu cực đến cây trồng và môi trường.","phac_do_mieng_nhai","mieng_nhai|oxatin|lieu_luong|hieu_qua|phong_tru_sau_hai","Tại sao liều lượng Oxatin 30-40ml/25L nước hiệu quả?|Lợi ích khi dùng đúng liều Oxatin cho sâu miệng nhai?|Hiệu quả của liều Oxatin khuyến cáo trên sâu miệng nhai?"
nh_m_mi_ng_nhai_chunk_01,"Phác đồ phối hợp thuốc phòng trừ nhóm sâu miệng nhai như thế nào?","Đối tượng sâu hại là nhóm miệng nhai. Công thức phối hợp khuyến cáo gồm Ohayo 100sc và Igro Ohayo 240sc, pha 24-50ml trên 25L nước tùy theo mật độ sâu và mức độ kháng thuốc. Hiệu quả đạt từ 80-90%. Lưu ý điều chỉnh liều lượng theo mật độ sâu để đạt hiệu quả tối ưu.","phac_do_mieng_nhai","mieng_nhai|phac_do|cong_thuc_phoi_hop|ohayo|igro_ohayo","Phác đồ thuốc cho nhóm sâu miệng nhai là gì?|Cách phối hợp Ohayo 100sc và Igro Ohayo 240sc ra sao?|Liều lượng thuốc Ohayo và Igro Ohayo dùng thế nào?|Hiệu quả của công thức phối hợp Ohayo và Igro Ohayo là bao nhiêu?"
nh_m_mi_ng_nhai_qa_01,"Nhóm sâu miệng nhai nên dùng công thức phối hợp thuốc nào và liều lượng ra sao?","Nhóm sâu miệng nhai nên dùng công thức phối hợp Ohayo 100sc và Igro Ohayo 240sc, pha 24-50ml trên 25L nước tùy theo mật độ sâu và mức độ kháng thuốc để đạt hiệu quả phòng trừ từ 80-90%.","phac_do_mieng_nhai","mieng_nhai|cong_thuc_phoi_hop|ohayo|igro_ohayo","Nhóm sâu miệng nhai dùng thuốc Ohayo và Igro Ohayo như thế nào?|Liều lượng thuốc Ohayo và Igro Ohayo cho sâu miệng nhai là bao nhiêu?"
nh_m_mi_ng_nhai_qa_02,"Có lưu ý gì khi sử dụng công thức phối hợp Ohayo 100sc và Igro Ohayo 240sc cho nhóm sâu miệng nhai?","Lưu ý điều chỉnh liều lượng Igro Ohayo 240sc từ 24-50ml/25L nước tùy theo mật độ sâu và mức độ kháng thuốc để đạt hiệu quả tối ưu từ 80-90%. Không nên dùng liều thấp khi mật độ sâu cao hoặc sâu đã có dấu hiệu kháng thuốc.","phac_do_mieng_nhai","mieng_nhai|luu_y|phac_do|ohayo|igro_ohayo","Khi nào nên tăng liều Igro Ohayo trong công thức phối hợp?|Lưu ý khi dùng Ohayo và Igro Ohayo cho sâu miệng nhai là gì?"
nh_m_mi_ng_nhai_qa_03,"Hiệu quả phòng trừ nhóm sâu miệng nhai khi dùng công thức Ohayo và Igro Ohayo đạt bao nhiêu phần trăm?","Hiệu quả phòng trừ nhóm sâu miệng nhai khi sử dụng công thức phối hợp Ohayo 100sc và Igro Ohayo 240sc đạt từ 80-90%, tùy thuộc vào việc điều chỉnh liều lượng phù hợp với mật độ sâu và mức độ kháng thuốc.","phac_do_mieng_nhai","mieng_nhai|hieu_qua|phac_do|ohayo|igro_ohayo","Công thức Ohayo và Igro Ohayo có hiệu quả phòng trừ sâu miệng nhai thế nào?|Tỷ lệ hiệu quả của công thức phối hợp Ohayo và Igro Ohayo là bao nhiêu?"
nh_m_mi_ng_nhai_chunk_01,"Phác đồ phối hợp thuốc phòng trừ nhóm sâu miệng nhai là gì?","Đối tượng sâu hại là nhóm sâu miệng nhai. Công thức phối hợp khuyến cáo sử dụng thuốc Zigen Xpro với liều lượng pha 24-50ml/25L nước, tùy theo mật độ sâu và mức độ kháng thuốc. Phác đồ này diệt trừ tốt cả sâu đục thân với hiệu quả đạt 80-90%.","phac_do_mieng_nhai","mieng_nhai|phac_do|zigen_xpro|sau_duc_than|cong_thuc_phoi_hop","Phác đồ phòng trừ sâu miệng nhai gồm những thuốc nào? | Liều lượng Zigen Xpro dùng cho sâu miệng nhai là bao nhiêu? | Hiệu quả của Zigen Xpro đối với sâu đục thân như thế nào? | Có lưu ý gì khi dùng Zigen Xpro cho nhóm sâu miệng nhai?"
nh_m_mi_ng_nhai_qa_01,"Nhóm sâu miệng nhai nên dùng công thức phối hợp thuốc nào để phòng trừ hiệu quả?","Nhóm sâu miệng nhai nên sử dụng công thức phối hợp thuốc Zigen Xpro với liều lượng pha 24-50ml/25L nước, tùy thuộc vào mật độ sâu và mức độ kháng thuốc. Công thức này giúp diệt trừ sâu đục thân rất tốt với hiệu quả từ 80-90%.","phac_do_mieng_nhai","mieng_nhai|zigen_xpro|sau_duc_than|phac_do|cong_thuc_phoi_hop","Nên dùng thuốc gì để phòng trừ sâu miệng nhai? | Liều lượng Zigen Xpro phù hợp cho sâu miệng nhai là bao nhiêu? | Zigen Xpro có hiệu quả ra sao với sâu đục thân?"
nh_m_mi_ng_nhai_qa_02,"Liều lượng pha thuốc Zigen Xpro như thế nào khi phòng trừ sâu miệng nhai?","Liều lượng pha thuốc Zigen Xpro khuyến cáo là từ 24 đến 50ml trên 25L nước, tùy theo mật độ sâu và mức độ kháng thuốc. Việc điều chỉnh liều lượng giúp đạt hiệu quả diệt trừ sâu đục thân từ 80-90%.","phac_do_mieng_nhai","zigen_xpro|lieu_luong|mieng_nhai|sau_duc_than|phac_do","Liều lượng Zigen Xpro dùng cho sâu miệng nhai là bao nhiêu? | Pha thuốc Zigen Xpro thế nào để đạt hiệu quả? | Có thể tăng giảm liều Zigen Xpro khi nào?"
nh_m_mi_ng_nhai_qa_03,"Công thức phối hợp Zigen Xpro có thể thay thế bằng thuốc nào khác không?","Thông tin hiện tại chỉ khuyến cáo sử dụng Zigen Xpro với liều lượng 24-50ml/25L nước cho nhóm sâu miệng nhai. Việc thay thế thuốc cần dựa trên đặc tính sâu hại, mức độ kháng thuốc và điều kiện thực tế, nên tham khảo thêm ý kiến chuyên gia hoặc hướng dẫn kỹ thuật cụ thể.","phac_do_mieng_nhai","zigen_xpro|mieng_nhai|thay_the_thuoc|phac_do|sau_duc_than","Có thể thay Zigen Xpro bằng thuốc khác không? | Thuốc thay thế Zigen Xpro cho sâu miệng nhai là gì? | Khi nào nên thay thuốc trong phác đồ sâu miệng nhai?"
nh_m_mi_ng_nhai_chunk_01,"Phác đồ phối hợp thuốc phòng trừ nhóm sâu miệng nhai như thế nào?","Đối tượng sâu hại là nhóm sâu miệng nhai, bao gồm ấu trùng sâu cuốn lá, đục thân và trĩ. Công thức phối hợp khuyến cáo là sử dụng các dạng thuốc hạt GR rải dưới gốc lúa sau khi sạ từ 15-20 ngày nhằm phòng trừ hiệu quả các đối tượng sâu hại này. Lưu ý, việc rải thuốc hạt GR dưới gốc giúp thuốc tiếp xúc trực tiếp với ấu trùng, tăng hiệu quả phòng trừ và hạn chế sử dụng thuốc phun trực tiếp, góp phần bảo vệ môi trường và sức khỏe người dùng.","phac_do_sau_hai","nhom_mieng_nhai|sau_cuon_la|sau_duc_than|tri|thuoc_hat_GR|phong_tru_sau_hai","Phác đồ thuốc cho nhóm sâu miệng nhai là gì?|Cách sử dụng thuốc hạt GR để phòng trừ sâu miệng nhai?|Khi nào nên rải thuốc hạt GR dưới gốc lúa?|Có lưu ý gì khi dùng thuốc hạt GR phòng sâu miệng nhai?"
nh_m_mi_ng_nhai_qa_01,"Khi nào nên rải thuốc hạt GR để phòng trừ sâu miệng nhai?","Nông dân nên rải các dạng thuốc hạt GR dưới gốc lúa từ 15 đến 20 ngày sau khi sạ để phòng trừ ấu trùng sâu cuốn lá, đục thân và trĩ hiệu quả. Thời điểm này giúp thuốc tiếp xúc trực tiếp với sâu non, tăng hiệu quả phòng trừ.","phac_do_sau_hai","thuoc_hat_GR|thoi_diem_riai|sau_mieng_nhai|phong_tru_sau","Khi nào là thời điểm tốt nhất để rải thuốc hạt GR phòng sâu miệng nhai?|Rải thuốc hạt GR sau bao lâu kể từ khi sạ lúa?|Thời điểm rải thuốc hạt GR để trừ sâu miệng nhai là khi nào?"
nh_m_mi_ng_nhai_qa_02,"Công dụng của thuốc hạt GR trong phác đồ phòng trừ nhóm sâu miệng nhai là gì?","Thuốc hạt GR được sử dụng để rải dưới gốc lúa nhằm phòng trừ ấu trùng sâu cuốn lá, sâu đục thân và trĩ. Thuốc dạng hạt giúp tiếp xúc trực tiếp với sâu non ở giai đoạn ấu trùng, từ đó tăng hiệu quả diệt trừ và giảm thiểu tác động đến môi trường so với thuốc phun trực tiếp.","phac_do_sau_hai","thuoc_hat_GR|cong_dung|phong_tru_sau|nhom_mieng_nhai","Thuốc hạt GR có tác dụng gì trong phòng trừ sâu miệng nhai?|Tại sao nên dùng thuốc hạt GR để trừ sâu cuốn lá và sâu đục thân?|Ưu điểm của thuốc hạt GR trong phác đồ phòng trừ sâu miệng nhai là gì?"
nh_m_mi_ng_nhai_qa_03,"Có lưu ý gì khi sử dụng thuốc hạt GR để phòng trừ sâu miệng nhai?","Lưu ý khi sử dụng thuốc hạt GR là cần rải đều dưới gốc lúa sau khi sạ từ 15-20 ngày để thuốc phát huy hiệu quả tối ưu. Tránh rải quá sớm hoặc quá muộn sẽ giảm hiệu quả phòng trừ. Ngoài ra, cần tuân thủ liều lượng và hướng dẫn sử dụng của nhà sản xuất để đảm bảo an toàn và hiệu quả.","phac_do_sau_hai","luu_y|thuoc_hat_GR|phong_tru_sau|nhom_mieng_nhai","Những lưu ý khi dùng thuốc hạt GR để phòng sâu miệng nhai?|Cần chú ý gì khi rải thuốc hạt GR dưới gốc lúa?|Có điều kiện gì cần nhớ khi sử dụng thuốc hạt GR phòng trừ sâu miệng nhai?"
nh_m_mi_ng_nhai_chunk_01,"Phác đồ phòng trừ sâu hại nhóm miệng nhai bằng phương pháp nào?","Đối tượng sâu hại là nhóm miệng nhai. Phác đồ khuyến cáo sử dụng phương pháp xông hơi mạnh để phòng trừ hiệu quả. Đây là biện pháp vật lý giúp tiêu diệt sâu hại mà không cần dùng thuốc hóa học.","phac_do_mieng_nhai","mieng_nhai|phong_tru|xong_hoi|phac_do","Phòng trừ sâu miệng nhai bằng cách nào? | Phương pháp xông hơi mạnh áp dụng cho sâu miệng nhai ra sao? | Làm thế nào để diệt sâu nhóm miệng nhai hiệu quả? | Có phác đồ nào cho sâu miệng nhai không?"
nh_m_mi_ng_nhai_qa_01,"Đối tượng sâu hại nào áp dụng phác đồ xông hơi mạnh?","Phác đồ xông hơi mạnh được áp dụng cho nhóm sâu miệng nhai nhằm tiêu diệt sâu hại hiệu quả mà không sử dụng thuốc hóa học, phù hợp trong các trường hợp cần hạn chế hóa chất.","phac_do_mieng_nhai","mieng_nhai|xong_hoi|phong_tru|khong_thuoc","Sâu miệng nhai nào dùng xông hơi mạnh? | Khi nào nên dùng xông hơi mạnh cho sâu miệng nhai? | Phương pháp xông hơi mạnh áp dụng cho sâu nào?"
nh_m_mi_ng_nhai_qa_02,"Phương pháp xông hơi mạnh được thực hiện như thế nào để phòng trừ sâu miệng nhai?","Phương pháp xông hơi mạnh là biện pháp vật lý, sử dụng hơi nóng với cường độ cao để tiêu diệt sâu hại nhóm miệng nhai. Cần thực hiện đúng kỹ thuật để đảm bảo hiệu quả và không gây hại cho cây trồng.","phac_do_mieng_nhai","mieng_nhai|xong_hoi|ky_thuat|phong_tru","Cách thực hiện xông hơi mạnh cho sâu miệng nhai? | Làm sao để xông hơi mạnh hiệu quả? | Kỹ thuật xông hơi mạnh phòng trừ sâu miệng nhai?"
nh_m_mi_ng_nhai_qa_03,"Có thể thay thế phương pháp xông hơi mạnh bằng thuốc hóa học không?","Phương pháp xông hơi mạnh ưu tiên sử dụng để hạn chế thuốc hóa học, tuy nhiên trong trường hợp cần thiết có thể phối hợp hoặc thay thế bằng thuốc bảo vệ thực vật phù hợp với nhóm sâu miệng nhai theo khuyến cáo chuyên môn.","phac_do_mieng_nhai","mieng_nhai|xong_hoi|thuoc_bvtv|phong_tru|phoi_hop","Có thể dùng thuốc thay xông hơi mạnh cho sâu miệng nhai không? | Thay thế xông hơi mạnh bằng thuốc nào? | Khi nào nên dùng thuốc thay cho xông hơi mạnh?"
nh_m_mi_ng_nhai_chunk_01,"Phác đồ phòng trừ nhóm sâu miệng nhai bằng công thức tiếp xúc mạnh là gì?","Đối tượng sâu hại là nhóm sâu miệng nhai. Phác đồ khuyến cáo sử dụng công thức phối hợp thuốc có tác động tiếp xúc mạnh để phòng trừ hiệu quả. Lưu ý cần áp dụng đúng liều lượng và thời điểm phun để đạt hiệu quả tối ưu và hạn chế sâu hại phát triển.","phac_do_mieng_nhai","mieng_nhai|phac_do|cong_thuc_tiep_xuc|phong_tru_sau_hai","phac_do phong tru nhom mieng nhai bang cong thuc tiep xuc|cong thuc tiep xuc trong phong tru sau mieng nhai la gi|huong dan su dung cong thuc tiep xuc cho nhom mieng nhai|khi nao dung cong thuc tiep xuc phong tru sau mieng nhai"
nh_m_mi_ng_nhai_qa_01,"Nhóm sâu miệng nhai nên dùng công thức thuốc nào để phòng trừ?","Nhóm sâu miệng nhai nên sử dụng công thức phối hợp thuốc có tác động tiếp xúc mạnh để phòng trừ sâu hại hiệu quả. Công thức này giúp tiêu diệt sâu ngay khi tiếp xúc, giảm thiểu tổn thất cho cây trồng.","phac_do_mieng_nhai","mieng_nhai|cong_thuc_tiep_xuc|phong_tru_sau","nhom sau mieng nhai dung cong thuc phong tru nao|cong thuc tiep xuc co tac dung gi voi nhom mieng nhai|thuoc phong tru nhom mieng nhai hieu qua nhat la gi"
nh_m_mi_ng_nhai_qa_02,"Có lưu ý gì khi sử dụng công thức tiếp xúc mạnh để phòng trừ nhóm sâu miệng nhai?","Khi sử dụng công thức tiếp xúc mạnh để phòng trừ nhóm sâu miệng nhai, cần chú ý phun thuốc đều trên toàn bộ diện tích cây trồng, đảm bảo thuốc tiếp xúc trực tiếp với sâu. Ngoài ra, nên tuân thủ liều lượng và thời gian cách ly để đảm bảo an toàn cho cây và môi trường.","phac_do_mieng_nhai","mieng_nhai|luu_y|cong_thuc_tiep_xuc|phong_tru_sau","luu y khi dung cong thuc tiep xuc phong tru nhom mieng nhai|phun thuoc tiep xuc nhu the nao cho hieu qua|co can chu y gi khi dung thuoc tiep xuc cho nhom mieng nhai"
nh_m_mi_ng_nhai_qa_03,"Có thể thay thế công thức tiếp xúc mạnh bằng công thức nào khác khi phòng trừ nhóm sâu miệng nhai không?","Phác đồ khuyến cáo ưu tiên sử dụng công thức tiếp xúc mạnh cho nhóm sâu miệng nhai do hiệu quả nhanh và mạnh. Tuy nhiên, trong trường hợp đặc biệt có thể tham khảo các công thức khác như tiếp xúc kết hợp lưu dẫn, nhưng cần đảm bảo hiệu quả và an toàn cho cây trồng.","phac_do_mieng_nhai","mieng_nhai|thay_the|cong_thuc_tiep_xuc|phong_tru_sau","co the thay cong thuc tiep xuc bang cong thuc khac cho nhom mieng nhai khong|phac do thay the cong thuc tiep xuc cho nhom mieng nhai|cong thuc phong tru thay the tiep xuc cho nhom mieng nhai la gi"
nh_m_mi_ng_nhai_chunk_01,"Phác đồ phối hợp thuốc phòng trừ nhóm sâu miệng nhai như thế nào?","Đối tượng sâu hại là nhóm miệng nhai. Phác đồ phối hợp thuốc khuyến cáo sử dụng công thức tiếp xúc-lưu dẫn mạnh để đạt hiệu quả cao trong phòng trừ. Lưu ý cần chọn thuốc có khả năng tiếp xúc và lưu dẫn mạnh để đảm bảo tiêu diệt sâu hại triệt để.","phac_do_mieng_nhai","mieng_nhai|phac_do|tiep_xuc_luu_dan|phong_tru_sau_hai","Phác đồ phòng trừ sâu miệng nhai gồm những gì? | Công thức phối hợp thuốc cho nhóm sâu miệng nhai là gì? | Làm sao để phòng trừ hiệu quả nhóm sâu miệng nhai? | Công thức tiếp xúc-lưu dẫn mạnh áp dụng thế nào cho sâu miệng nhai?"
nh_m_mi_ng_nhai_qa_01,"Nhóm sâu miệng nhai nên dùng công thức phối hợp thuốc nào để phòng trừ hiệu quả?","Nhóm sâu miệng nhai nên sử dụng công thức phối hợp thuốc tiếp xúc-lưu dẫn mạnh. Công thức này giúp thuốc phát huy tác dụng nhanh qua tiếp xúc và kéo dài hiệu quả nhờ khả năng lưu dẫn trong cây, từ đó tiêu diệt sâu hại hiệu quả hơn.","phac_do_mieng_nhai","mieng_nhai|cong_thuc_phoi_hop|tiep_xuc_luu_dan|phong_tru_sau","Nhóm sâu miệng nhai dùng công thức thuốc nào? | Công thức thuốc cho sâu miệng nhai là gì? | Phòng trừ sâu miệng nhai bằng công thức nào hiệu quả?"
nh_m_mi_ng_nhai_qa_02,"Có lưu ý gì khi sử dụng công thức tiếp xúc-lưu dẫn mạnh để phòng trừ nhóm sâu miệng nhai không?","Khi sử dụng công thức tiếp xúc-lưu dẫn mạnh để phòng trừ nhóm sâu miệng nhai, cần lựa chọn thuốc có phổ tác dụng rộng, đảm bảo khả năng tiếp xúc và lưu dẫn tốt trong cây. Ngoài ra, cần tuân thủ đúng liều lượng và thời gian phun để tránh sâu hại kháng thuốc và bảo vệ môi trường.","phac_do_mieng_nhai","mieng_nhai|luu_y|tiep_xuc_luu_dan|phong_tru_sau","Lưu ý khi dùng công thức tiếp xúc-lưu dẫn cho sâu miệng nhai? | Cần chú ý gì khi phun thuốc tiếp xúc-lưu dẫn? | Làm sao để sử dụng công thức thuốc hiệu quả cho sâu miệng nhai?"
nh_m_mi_ng_nhai_qa_03,"Có thể thay đổi thuốc trong công thức tiếp xúc-lưu dẫn mạnh khi phòng trừ nhóm sâu miệng nhai không?","Có thể thay đổi thuốc trong công thức tiếp xúc-lưu dẫn mạnh tùy theo điều kiện thực tế và loại sâu hại cụ thể. Tuy nhiên, thuốc thay thế cần đảm bảo tính tiếp xúc và lưu dẫn mạnh để duy trì hiệu quả phòng trừ sâu miệng nhai, đồng thời tránh sử dụng thuốc cùng nhóm cơ chế để hạn chế kháng thuốc.","phac_do_mieng_nhai","mieng_nhai|thay_thuoc|tiep_xuc_luu_dan|phong_tru_sau","Có thể thay thuốc trong công thức tiếp xúc-lưu dẫn không? | Thay thuốc thế nào khi dùng công thức tiếp xúc-lưu dẫn? | Lựa chọn thuốc thay thế cho sâu miệng nhai ra sao?"
nh_m_mi_ng_nhai_chunk_01,"Phác đồ phối hợp thuốc phòng trừ nhóm sâu miệng nhai như sâu đục quả sầu riêng là gì?","Đối tượng sâu hại là nhóm sâu miệng nhai, điển hình như sâu đục quả sầu riêng. Mật độ sâu không được nêu cụ thể, tuy nhiên công thức phối hợp khuyến cáo là pha thuốc Zigen Xpro với liều lượng 24ml trên 20L nước và phun đều lên cây. Phun thuốc theo công thức này sẽ cho hiệu quả rất tốt trong việc phòng trừ sâu đục quả sầu riêng. Lưu ý cần đảm bảo pha đúng liều lượng và phun đều để đạt hiệu quả tối ưu.","phac_do_mieng_nhai","sau_mieng_nhai|sau_duc_qua|phac_do|cong_thuc_phoi_hop|zigen_xpro","Phòng trừ sâu đục quả sầu riêng bằng công thức Zigen Xpro như thế nào?|Cách pha thuốc Zigen Xpro để diệt sâu miệng nhai?|Liều lượng và cách phun Zigen Xpro cho sâu đục quả sầu riêng?|Có lưu ý gì khi dùng Zigen Xpro phòng sâu đục quả sầu riêng?"
nh_m_mi_ng_nhai_qa_01,"Sâu đục quả sầu riêng thuộc nhóm sâu nào và cách phòng trừ ra sao?","Sâu đục quả sầu riêng thuộc nhóm sâu miệng nhai. Để phòng trừ hiệu quả, nên sử dụng thuốc Zigen Xpro pha với liều lượng 24ml trên 20L nước và phun đều lên cây. Công thức này giúp kiểm soát sâu tốt, hạn chế tổn thất quả sầu riêng.","phac_do_mieng_nhai","sau_duc_qua|mieng_nhai|phong_tru|zigen_xpro","Sâu đục quả sầu riêng thuộc nhóm sâu nào?|Cách phòng trừ sâu đục quả sầu riêng hiệu quả?|Dùng thuốc gì để diệt sâu đục quả sầu riêng?"
nh_m_mi_ng_nhai_qa_02,"Liều lượng và cách pha thuốc Zigen Xpro để phòng trừ sâu miệng nhai như thế nào?","Liều lượng khuyến cáo của thuốc Zigen Xpro là 24ml pha với 20L nước. Phun đều lên cây để phòng trừ sâu miệng nhai, đặc biệt là sâu đục quả sầu riêng. Việc pha đúng liều và phun đều giúp thuốc phát huy hiệu quả tối đa.","phac_do_mieng_nhai","zigen_xpro|lieu_luong|phoi_pha|mieng_nhai|phong_tru","Cách pha thuốc Zigen Xpro để diệt sâu miệng nhai?|Liều lượng Zigen Xpro dùng cho sâu đục quả sầu riêng là bao nhiêu?|Phun thuốc Zigen Xpro như thế nào để đạt hiệu quả cao?"
nh_m_mi_ng_nhai_qa_03,"Có lưu ý gì khi sử dụng thuốc Zigen Xpro để phòng trừ sâu đục quả sầu riêng?","Khi sử dụng thuốc Zigen Xpro để phòng trừ sâu đục quả sầu riêng, cần pha đúng liều lượng 24ml/20L nước và phun đều lên cây. Tránh phun thuốc khi trời mưa hoặc nắng gắt để đảm bảo hiệu quả. Có thể thay thế thuốc bằng các sản phẩm có hoạt chất tương tự nếu có khuyến cáo từ chuyên gia hoặc nhà sản xuất.","phac_do_mieng_nhai","luu_y|phun_thuoc|mieng_nhai|sau_duc_qua|zigen_xpro","Lưu ý khi dùng Zigen Xpro phòng sâu đục quả sầu riêng?|Có thể thay thuốc Zigen Xpro bằng loại nào khác không?|Khi nào nên phun thuốc Zigen Xpro để đạt hiệu quả cao?"
nh_m_c_tr_chunk_01,"Phác đồ phối hợp thuốc nào được khuyến cáo để phòng trừ nhóm sâu đặc trị?","Phác đồ phối hợp thuốc khuyến cáo để phòng trừ nhóm sâu đặc trị bao gồm: Matscot 50SP (Cyromazine 50%w/w) với liều lượng 50 gram, kết hợp cùng Sha chong jing 50 gram và Zigen hoặc Tamatras 30 ml. Công thức này giúp kiểm soát hiệu quả sâu hại trong nhóm đặc trị. Lưu ý cần pha đúng liều lượng và sử dụng đồng đều các thành phần để đạt hiệu quả tối ưu.","phac_do_dac_tri","nhom_dac_tri|phac_do|cong_thuc_phoi_hop|thuoc_bvtv","Phác đồ thuốc nào dùng cho nhóm sâu đặc trị? | Công thức phối hợp thuốc phòng trừ nhóm đặc trị gồm những gì? | Liều lượng phối trộn thuốc Matscot và Sha chong jing ra sao? | Có lưu ý gì khi sử dụng phác đồ thuốc cho nhóm sâu đặc trị?"
nh_m_c_tr_qa_01,"Nhóm sâu đặc trị nên dùng công thức phối hợp thuốc nào để phòng trừ hiệu quả?","Nhóm sâu đặc trị nên sử dụng công thức phối hợp gồm Matscot 50SP (Cyromazine 50%w/w) 50 gram, Sha chong jing 50 gram và Zigen hoặc Tamatras 30 ml. Công thức này giúp kiểm soát sâu hại hiệu quả khi áp dụng đúng liều lượng và kỹ thuật phun thuốc.","phac_do_dac_tri","nhom_dac_tri|cong_thuc_phoi_hop|phong_tru_sau_hai","Nhóm sâu đặc trị dùng thuốc gì để phòng trừ? | Công thức phối hợp thuốc cho nhóm sâu đặc trị là gì?"
nh_m_c_tr_qa_02,"Liều lượng phối trộn thuốc Matscot, Sha chong jing và Zigen/Tamatras như thế nào?","Liều lượng phối trộn thuốc trong phác đồ phòng trừ nhóm sâu đặc trị gồm: Matscot 50SP (Cyromazine 50%w/w) 50 gram, Sha chong jing 50 gram và Zigen hoặc Tamatras 30 ml. Cần pha đúng tỷ lệ này để đảm bảo hiệu quả phòng trừ sâu hại tối ưu.","phac_do_dac_tri","lieu_luong|phoi_tron|thuoc_bvtv|phac_do","Liều lượng phối trộn thuốc Matscot và Sha chong jing là bao nhiêu? | Tỷ lệ phối trộn thuốc trong phác đồ nhóm sâu đặc trị?"
