id,question,answer,category,tags,alt_questions
nh_m_ch_ch_h_t_qa_02,"Có thể thay Lekima bằng thuốc nào khác khi phòng trừ sâu chích hút không?","Trong phác đồ phòng trừ nhóm sâu chích hút, Lekima được khuyến cáo để trừ toàn bộ trứng sâu. Nếu không có Lekima, cần lựa chọn thuốc có phổ tác dụng tương tự, có khả năng diệt trứng và sâu non, đồng thời phù hợp với loại cây trồng và điều kiện sử dụng. Tuy nhiên, việc thay thế cần tham khảo kỹ hướng dẫn sử dụng và tư vấn chuyên gia.","phac_do_sau_chich_hut","sau_chich_hut|lekima|thay_the_thuoc|phong_tru_sau","Có thể thay Lekima bằng thuốc nào? | Thuốc thay thế Lekima trong phác đồ sâu chích hút? | Lưu ý khi thay thuốc trong phác đồ sâu chích hút?"
nh_m_ch_ch_h_t_qa_03,"Tại sao nên kết hợp Lekima để trừ trứng trong phác đồ phòng trừ sâu chích hút?","Lekima được khuyến cáo phối hợp trong phác đồ phòng trừ sâu chích hút vì có khả năng trừ toàn bộ trứng sâu, giúp ngăn ngừa sự phát sinh và phát triển của sâu hại. Việc xử lý trứng ngay từ đầu giúp giảm mật độ sâu non và trưởng thành, nâng cao hiệu quả phòng trừ và bảo vệ cây trồng tốt hơn.","phac_do_sau_chich_hut","lekima|trung_sau|phong_tru_sau|hieu_qua|sau_chich_hut","Tại sao dùng Lekima để trừ trứng sâu? | Lợi ích của việc trừ trứng trong phòng trừ sâu chích hút? | Lekima có tác dụng gì trong phác đồ sâu chích hút?"
nh_m_ch_ch_h_t_chunk_01,"Phác đồ phòng trừ nhóm sâu chích hút mật độ bình thường gồm những gì?","Đối tượng sâu hại là nhóm chích hút với mật độ xuất hiện bình thường. Công thức phối hợp khuyến cáo gồm xông hơi kết hợp với toàn bộ lưu dẫn (bao gồm cả lưu dẫn thường và mạnh) để đạt hiệu quả phòng trừ tối ưu. Lưu ý khi áp dụng cần đảm bảo đúng liều lượng và kỹ thuật xông hơi, đồng thời lựa chọn loại lưu dẫn phù hợp với điều kiện thực tế để tránh gây hại cho cây trồng và môi trường.","phac_do_sau_chich_hut","sau_chich_hut|mat_do_binh_thuong|cong_thuc_phoi_hop|xong_hoi|luu_dan","Phác đồ phòng trừ sâu chích hút mật độ bình thường là gì?|Cách phối hợp thuốc xông hơi và lưu dẫn cho sâu chích hút?|Khi nào dùng lưu dẫn mạnh trong phác đồ sâu chích hút?|Lưu ý khi áp dụng phác đồ xông hơi và lưu dẫn cho sâu chích hút"
nh_m_ch_ch_h_t_qa_01,"Khi nhóm sâu chích hút xuất hiện mật độ bình thường, công thức phối hợp thuốc nào được khuyến cáo?","Khi nhóm sâu chích hút xuất hiện với mật độ bình thường, công thức phối hợp khuyến cáo là sử dụng phương pháp xông hơi kết hợp với toàn bộ lưu dẫn, bao gồm cả lưu dẫn thường và lưu dẫn mạnh nhằm tăng hiệu quả phòng trừ sâu hại.","phac_do_sau_chich_hut","sau_chich_hut|mat_do_binh_thuong|cong_thuc_phoi_hop|xong_hoi|luu_dan","Công thức phối hợp thuốc cho sâu chích hút mật độ bình thường là gì?|Phòng trừ sâu chích hút mật độ bình thường bằng cách nào?|Dùng thuốc nào khi sâu chích hút mật độ bình thường?"
nh_m_ch_ch_h_t_qa_02,"Công thức xông hơi phối hợp với lưu dẫn thường và mạnh có tác dụng gì trong phòng trừ sâu chích hút?","Công thức xông hơi phối hợp với lưu dẫn thường và mạnh giúp tăng khả năng tiếp xúc và thẩm thấu thuốc vào sâu chích hút, từ đó nâng cao hiệu quả phòng trừ sâu hại ở mật độ bình thường. Phương pháp này cũng giúp giảm thiểu khả năng sâu kháng thuốc và bảo vệ cây trồng hiệu quả hơn.","phac_do_sau_chich_hut","xong_hoi|luu_dan|tang_hieu_qua|phong_tru_sau_hai","Tác dụng của phối hợp xông hơi và lưu dẫn trong phòng sâu chích hút?|Lợi ích khi dùng lưu dẫn mạnh phối hợp xông hơi là gì?|Tại sao nên phối hợp xông hơi với lưu dẫn khi sâu chích hút mật độ bình thường?"
nh_m_ch_ch_h_t_qa_03,"Có thể thay thế lưu dẫn thường và mạnh bằng loại thuốc nào khác trong phác đồ phòng trừ sâu chích hút không?","Trong phác đồ phòng trừ sâu chích hút mật độ bình thường, lưu dẫn thường và mạnh được khuyến cáo sử dụng để đảm bảo hiệu quả cao. Việc thay thế cần cân nhắc kỹ lưỡng dựa trên đặc tính thuốc, phổ tác động và điều kiện thực tế. Có thể tham khảo các loại thuốc lưu dẫn khác có cùng cơ chế hoạt động nhưng phải đảm bảo không làm giảm hiệu quả và an toàn cho cây trồng.","phac_do_sau_chich_hut","luu_dan|thay_the_thuoc|phac_do|phong_tru_sau_hai","Có thể thay lưu dẫn trong phác đồ sâu chích hút không?|Những lưu ý khi thay thế thuốc lưu dẫn trong phác đồ?|Thuốc lưu dẫn thay thế cho sâu chích hút là gì?"
nh_m_ch_ch_h_t_qa_04,"Khi nào nên ưu tiên sử dụng lưu dẫn mạnh trong phác đồ phòng trừ sâu chích hút?","Lưu dẫn mạnh nên được ưu tiên sử dụng khi sâu chích hút xuất hiện với mật độ bình thường nhưng có dấu hiệu kháng thuốc hoặc khi điều kiện môi trường làm giảm hiệu quả của lưu dẫn thường. Việc sử dụng lưu dẫn mạnh giúp tăng khả năng thẩm thấu và kéo dài thời gian tác động của thuốc, từ đó nâng cao hiệu quả phòng trừ.","phac_do_sau_chich_hut","luu_dan_manh|uu_tien|phong_tru_sau_hai|mat_do_binh_thuong","Khi nào dùng lưu dẫn mạnh cho sâu chích hút?|Ưu điểm của lưu dẫn mạnh trong phác đồ sâu chích hút?|Lưu dẫn mạnh phù hợp với điều kiện nào?"
nh_m_ch_ch_h_t_chunk_01,"Phác đồ phòng trừ sâu hại nhóm chích hút mật độ cao gồm những gì?","Đối tượng sâu hại là nhóm chích hút với mật độ xuất hiện cao. Công thức phối hợp khuyến cáo gồm sử dụng dòng xông hơi mạnh kết hợp với toàn bộ lưu dẫn (cả thường và mạnh) để đạt hiệu quả phòng trừ tối ưu. Lưu ý nên áp dụng đồng thời cả hai phương pháp để tăng hiệu quả và hạn chế sâu hại phát triển.","phac_do_sau_hai","nhom_chich_hut|mat_do_cao|dong_xong_hoi_manh|luu_dan_thuong_va_manh","Phác đồ phòng trừ sâu chích hút mật độ cao là gì?|Cách phối hợp dòng xông hơi và lưu dẫn để diệt sâu chích hút?|Khi nào nên dùng dòng xông hơi mạnh phối hợp lưu dẫn?|Lưu ý khi sử dụng dòng xông hơi và lưu dẫn cho sâu chích hút?"
nh_m_ch_ch_h_t_qa_01,"Khi sâu chích hút mật độ cao, công thức phối hợp thuốc nào được khuyến cáo?","Khi sâu chích hút xuất hiện với mật độ cao, công thức phối hợp khuyến cáo là sử dụng dòng xông hơi mạnh kết hợp với toàn bộ lưu dẫn (thường và mạnh). Phối hợp này giúp tăng hiệu quả phòng trừ sâu hại, đảm bảo thuốc thấm sâu và lan tỏa tốt.","phac_do_sau_hai","nhom_chich_hut|mat_do_cao|dong_xong_hoi_manh|luu_dan","Công thức thuốc cho sâu chích hút mật độ cao là gì?|Phối hợp dòng xông hơi mạnh và lưu dẫn khi nào?|Thuốc nào dùng cho sâu chích hút mật độ cao?"
nh_m_ch_ch_h_t_qa_02,"Công thức phối hợp dòng xông hơi mạnh và lưu dẫn được sử dụng như thế nào?","Công thức phối hợp gồm sử dụng dòng xông hơi mạnh để tạo hiệu ứng xông hơi diệt sâu nhanh, kết hợp với toàn bộ lưu dẫn (cả thường và mạnh) giúp thuốc thấm sâu vào cây và lan tỏa đều, tăng hiệu quả phòng trừ sâu chích hút. Việc phối hợp này cần thực hiện đồng thời để đạt hiệu quả tối ưu.","phac_do_sau_hai","dong_xong_hoi_manh|luu_dan|phoi_hop_thuoc","Phối hợp dòng xông hơi và lưu dẫn như thế nào?|Cách sử dụng dòng xông hơi mạnh phối hợp lưu dẫn?|Hiệu quả của phối hợp dòng xông hơi và lưu dẫn?"
nh_m_ch_ch_h_t_qa_03,"Có thể thay thế lưu dẫn thường và mạnh bằng thuốc khác không?","Trong phác đồ này, toàn bộ lưu dẫn (thường và mạnh) được khuyến cáo để đảm bảo hiệu quả tối ưu. Việc thay thế cần cân nhắc kỹ lưỡng dựa trên đặc tính thuốc thay thế, khả năng thấm sâu và lan tỏa. Nếu thay thế, nên chọn thuốc có tính lưu dẫn tương đương để không làm giảm hiệu quả phòng trừ sâu chích hút.","phac_do_sau_hai","luu_dan|thay_the_thuoc|phac_do_sau_hai","Có thể thay lưu dẫn bằng thuốc khác không?|Lưu ý khi thay thế lưu dẫn trong phác đồ?|Thuốc thay thế lưu dẫn phù hợp cho sâu chích hút?"
nh_m_ch_ch_h_t_chunk_01,"Phác đồ phối hợp thuốc phòng trừ nhóm sâu chích hút là gì?","Đối tượng sâu hại là nhóm chích hút. Công thức phối hợp khuyến cáo gồm Suparep, Ecudor hoặc Tamatras kết hợp với toàn bộ thuốc lưu dẫn (bao gồm loại thường và mạnh). Việc phối hợp này giúp tăng hiệu quả phòng trừ sâu hại nhờ tác động kép vừa tiếp xúc vừa lưu dẫn. Lưu ý khi sử dụng cần tuân thủ đúng liều lượng và điều kiện áp dụng của từng loại thuốc để tránh gây hại cho cây trồng và môi trường.","phac_do_sau_chich_hut","sau_chich_hut|phac_do|cong_thuc_phoi_hop|thuoc_luu_dan","Phác đồ phòng trừ sâu chích hút gồm những thuốc nào?|Cách phối hợp Suparep, Ecudor, Tamatras với thuốc lưu dẫn ra sao?|Lưu ý khi dùng thuốc lưu dẫn trong phác đồ sâu chích hút"
nh_m_ch_ch_h_t_qa_01,"Khi nào nên sử dụng phác đồ phối hợp Suparep/Ecudor/Tamatras với thuốc lưu dẫn để phòng trừ sâu chích hút?","Phác đồ phối hợp Suparep, Ecudor hoặc Tamatras cùng toàn bộ thuốc lưu dẫn (thường và mạnh) được khuyến cáo sử dụng khi sâu hại thuộc nhóm chích hút xuất hiện với mật độ cao hoặc có nguy cơ gây hại nghiêm trọng. Việc phối hợp này giúp tăng hiệu quả phòng trừ sâu nhờ tác động đa chiều và kéo dài thời gian bảo vệ cây trồng.","phac_do_sau_chich_hut","sau_chich_hut|phac_do|cong_thuc_phoi_hop|thuoc_luu_dan","Khi nào dùng phác đồ Suparep phối hợp thuốc lưu dẫn cho sâu chích hút?|Mật độ sâu chích hút bao nhiêu thì áp dụng phác đồ này?"
nh_m_ch_ch_h_t_qa_02,"Công thức phối hợp Suparep, Ecudor hoặc Tamatras với thuốc lưu dẫn được pha trộn như thế nào?","Công thức phối hợp gồm Suparep, Ecudor hoặc Tamatras kết hợp với toàn bộ các loại thuốc lưu dẫn (bao gồm cả lưu dẫn thường và lưu dẫn mạnh). Tỷ lệ pha trộn cần tuân thủ theo hướng dẫn của từng loại thuốc, đảm bảo không vượt quá liều lượng khuyến cáo để tránh gây độc cho cây trồng và đảm bảo hiệu quả phòng trừ sâu hại tối ưu.","phac_do_sau_chich_hut","phoi_hop|suparep|ecudor|tamatras|thuoc_luu_dan","Cách pha trộn Suparep với thuốc lưu dẫn ra sao?|Tỷ lệ phối trộn thuốc Suparep và Ecudor với lưu dẫn thế nào?"
nh_m_ch_ch_h_t_qa_03,"Có thể thay thế thuốc lưu dẫn trong phác đồ phối hợp với Suparep, Ecudor hoặc Tamatras không?","Trong phác đồ phối hợp này, toàn bộ thuốc lưu dẫn (bao gồm loại thường và mạnh) được khuyến cáo sử dụng để đảm bảo hiệu quả phòng trừ sâu chích hút. Việc thay thế thuốc lưu dẫn cần được cân nhắc kỹ lưỡng dựa trên tính chất thuốc, phổ tác động và hướng dẫn chuyên môn để tránh giảm hiệu quả hoặc gây hại cho cây trồng.","phac_do_sau_chich_hut","thuoc_luu_dan|thay_the|phac_do|suparep|ecudor|tamatras","Có thể thay thuốc lưu dẫn trong phác đồ Suparep phối hợp không?|Thay thế thuốc lưu dẫn bằng loại khác có ảnh hưởng gì?"
nh_m_ch_ch_h_t_qa_04,"Lưu ý quan trọng khi sử dụng phác đồ phối hợp Suparep/Ecudor/Tamatras với thuốc lưu dẫn là gì?","Khi sử dụng phác đồ phối hợp Suparep, Ecudor hoặc Tamatras với toàn bộ thuốc lưu dẫn, cần tuân thủ đúng liều lượng, thời gian phun và điều kiện áp dụng của từng loại thuốc. Tránh phối trộn với các thuốc không tương thích, đảm bảo an toàn cho cây trồng và môi trường. Ngoài ra, cần theo dõi mật độ sâu hại để điều chỉnh phác đồ phù hợp, tránh lạm dụng thuốc gây kháng thuốc và ô nhiễm môi trường.","phac_do_sau_chich_hut","luu_y|phac_do|suparep|ecudor|tamatras|thuoc_luu_dan","Những lưu ý khi dùng phác đồ phối hợp Suparep với thuốc lưu dẫn?|Cần chú ý gì khi phối hợp thuốc Suparep, Ecudor, Tamatras với lưu dẫn?"
nh_m_ch_ch_h_t_chunk_01,"Phác đồ phối hợp thuốc phòng trừ nhóm sâu chích hút như thế nào?","Đối tượng sâu hại là nhóm sâu chích hút. Công thức phối hợp khuyến cáo là sử dụng Lekima để trừ toàn bộ trứng. Cần pha thuốc và tưới gốc để trừ rệp dưới đất hoặc có thể rải dạng hạt GR dưới gốc. Lưu ý quan trọng là phải áp dụng đúng liều lượng và phương pháp tưới hoặc rải hạt để đạt hiệu quả cao.","phac_do_sau_chich_hut","sau_chich_hut|lekima|tuoi_goc|phoi_hop_thuoc|trung_sau","Phác đồ phòng trừ sâu chích hút như thế nào? | Cách phối hợp Lekima để trừ sâu chích hút ra sao? | Làm thế nào để trừ rệp dưới đất nhóm sâu chích hút? | Có thể dùng thuốc nào để trừ trứng sâu chích hút? | Cách sử dụng thuốc dạng hạt GR trong phòng trừ sâu chích hút?"
nh_m_ch_ch_h_t_qa_01,"Nhóm sâu chích hút cần áp dụng phác đồ phối hợp thuốc như thế nào?","Nhóm sâu chích hút cần sử dụng công thức phối hợp với thuốc Lekima để trừ toàn bộ trứng. Thuốc cần được pha và tưới gốc nhằm trừ rệp dưới đất hoặc có thể rải dạng hạt GR dưới gốc để đạt hiệu quả tốt nhất.","phac_do_sau_chich_hut","sau_chich_hut|lekima|tuoi_goc|phoi_hop_thuoc","Nhóm sâu chích hút dùng phác đồ phối hợp thuốc nào? | Cách dùng Lekima để trừ sâu chích hút? | Phương pháp tưới gốc để trừ rệp nhóm sâu chích hút?"
nh_m_ch_ch_h_t_qa_02,"Có thể thay thế Lekima trong phác đồ phòng trừ nhóm sâu chích hút không?","Thông tin hiện tại chỉ khuyến cáo sử dụng Lekima để trừ toàn bộ trứng nhóm sâu chích hút. Chưa có đề xuất thuốc thay thế cụ thể, do đó nên ưu tiên sử dụng Lekima theo hướng dẫn để đảm bảo hiệu quả phòng trừ.","phac_do_sau_chich_hut","sau_chich_hut|lekima|thuoc_thay_the|phac_do_phong_tru","Có thể thay Lekima bằng thuốc khác không? | Thuốc thay thế Lekima trong phòng trừ sâu chích hút? | Ưu tiên dùng Lekima hay thuốc khác?"
nh_m_ch_ch_h_t_qa_03,"Khi nào nên tưới gốc hoặc rải dạng hạt GR trong phác đồ phòng trừ sâu chích hút?","Cần tưới gốc thuốc pha Lekima để trừ rệp dưới đất hoặc có thể rải dạng hạt GR dưới gốc khi sâu chích hút xuất hiện ở mật độ cao dưới đất. Việc này giúp thuốc tiếp xúc trực tiếp với đối tượng sâu hại, nâng cao hiệu quả phòng trừ.","phac_do_sau_chich_hut","sau_chich_hut|tuoi_goc|rai_hat_gr|phac_do_phong_tru","Khi nào nên tưới gốc thuốc trong phòng trừ sâu chích hút? | Cách sử dụng dạng hạt GR để trừ sâu chích hút? | Phương pháp áp dụng thuốc dưới gốc hiệu quả?"
nh_m_ch_ch_h_t_chunk_01,"Phác đồ phối hợp thuốc phòng trừ nhóm sâu chích hút mật độ bình thường là gì?","Đối tượng sâu hại là nhóm chích hút với mật độ xuất hiện bình thường. Công thức phối hợp khuyến cáo gồm thuốc Zigen, Tamatras kết hợp với thuốc lưu dẫn để tăng hiệu quả phòng trừ. Lưu ý khi sử dụng cần đảm bảo pha trộn đúng liều lượng và phun đều để đạt hiệu quả tốt nhất.","phac_do_sau_chich_hut","nhom_chich_hut|phac_do|cong_thuc_phoi_hop|luu_dan|muc_do_binh_thuong","Phòng trừ nhóm sâu chích hút mật độ bình thường bằng công thức nào? | Công thức phối hợp thuốc Zigen, Tamatras và lưu dẫn dùng ra sao? | Khi mật độ sâu chích hút bình thường nên dùng thuốc gì? | Lưu ý khi sử dụng phối hợp Zigen và Tamatras là gì?"
nh_m_ch_ch_h_t_qa_01,"Khi mật độ nhóm sâu chích hút bình thường, nên sử dụng công thức thuốc nào để phòng trừ hiệu quả?","Khi mật độ nhóm sâu chích hút ở mức bình thường, nên sử dụng công thức phối hợp thuốc Zigen và Tamatras kết hợp với thuốc lưu dẫn để tăng hiệu quả phòng trừ sâu hại.","phac_do_sau_chich_hut","nhom_chich_hut|muc_do_binh_thuong|phac_do|cong_thuc_phoi_hop","Mật độ bình thường nhóm sâu chích hút dùng thuốc gì? | Công thức phòng trừ nhóm chích hút mật độ bình thường là gì?"
nh_m_ch_ch_h_t_qa_02,"Công thức phối hợp Zigen, Tamatras và lưu dẫn được sử dụng như thế nào để phòng trừ nhóm sâu chích hút?","Công thức phối hợp gồm Zigen, Tamatras và thuốc lưu dẫn được pha trộn theo tỷ lệ khuyến cáo, phun đều trên diện tích cây trồng để phòng trừ nhóm sâu chích hút với mật độ bình thường, giúp tăng hiệu quả và kéo dài thời gian bảo vệ.","phac_do_sau_chich_hut","cong_thuc_phoi_hop|nhom_chich_hut|phun_thuoc|luu_dan","Cách phối hợp Zigen, Tamatras và lưu dẫn để phòng trừ sâu chích hút? | Tỷ lệ phối trộn thuốc Zigen và Tamatras với lưu dẫn như thế nào?"
nh_m_ch_ch_h_t_qa_03,"Có thể thay thế thuốc nào trong công thức phối hợp Zigen, Tamatras và lưu dẫn khi phòng trừ nhóm sâu chích hút không?","Trong công thức phối hợp Zigen, Tamatras và lưu dẫn, có thể thay thế một trong các thuốc bằng sản phẩm tương đương có cùng hoạt chất và phổ tác dụng tương tự, tuy nhiên cần đảm bảo hiệu quả phòng trừ và tuân thủ hướng dẫn sử dụng của nhà sản xuất.","phac_do_sau_chich_hut","thay_thuoc|cong_thuc_phoi_hop|nhom_chich_hut|phac_do","Có thể thay thuốc nào trong công thức Zigen, Tamatras và lưu dẫn? | Thay thế thuốc trong phác đồ phòng trừ nhóm sâu chích hút như thế nào?"
nh_m_ch_ch_h_t_qa_04,"Khi nào nên ưu tiên sử dụng thuốc lưu dẫn trong phác đồ phòng trừ nhóm sâu chích hút?","Thuốc lưu dẫn nên được ưu tiên sử dụng trong phác đồ phòng trừ nhóm sâu chích hút để tăng hiệu quả bảo vệ lâu dài, đặc biệt khi mật độ sâu hại ở mức bình thường hoặc có xu hướng tăng, giúp hạn chế tái phát và giảm số lần phun thuốc.","phac_do_sau_chich_hut","luu_dan|phac_do|nhom_chich_hut|phun_thuoc","Khi nào cần dùng thuốc lưu dẫn trong phác đồ phòng trừ sâu chích hút? | Ưu điểm của thuốc lưu dẫn trong phòng trừ nhóm sâu chích hút là gì?"
nh_m_ch_ch_h_t_chunk_01,"Phác đồ phối hợp thuốc phòng trừ sâu chích hút mật độ cao, kháng cáo là gì?","Đối tượng sâu hại là nhóm chích hút với mật độ xuất hiện cao và có hiện tượng kháng cáo. Công thức phối hợp khuyến cáo gồm thuốc tiếp xúc có lưu dẫn mạnh kết hợp với thuốc lưu dẫn để tăng hiệu quả phòng trừ. Lưu ý cần chọn thuốc phù hợp với nhóm sâu chích hút và tuân thủ liều lượng, thời gian cách ly để tránh tồn dư và kháng thuốc.","phac_do_sau_chich_hut","sau_chich_hut|mat_do_cao|khang_cao|cong_thuc_phoi_hop|thuoc_tiep_xuc|thuoc_luu_dan","Phác đồ thuốc cho sâu chích hút mật độ cao là gì?|Cách phối hợp thuốc phòng sâu chích hút kháng cáo?|Thuốc nào dùng cho sâu chích hút mật độ cao?|Lưu ý khi dùng thuốc cho sâu chích hút mật độ cao?"
nh_m_ch_ch_h_t_qa_01,"Khi sâu chích hút mật độ cao và kháng cáo, nên dùng công thức phối hợp thuốc nào?","Khi sâu chích hút xuất hiện với mật độ cao và có hiện tượng kháng cáo, nên sử dụng công thức phối hợp thuốc gồm thuốc tiếp xúc có lưu dẫn mạnh kết hợp với thuốc lưu dẫn. Công thức này giúp tăng hiệu quả diệt trừ sâu và hạn chế tình trạng kháng thuốc.","phac_do_sau_chich_hut","sau_chich_hut|mat_do_cao|khang_cao|cong_thuc_phoi_hop","Công thức thuốc cho sâu chích hút mật độ cao kháng cáo là gì?|Phối hợp thuốc nào hiệu quả cho sâu chích hút mật độ cao?"
nh_m_ch_ch_h_t_qa_02,"Công thức phối hợp thuốc tiếp xúc lưu dẫn mạnh và lưu dẫn có tác dụng gì trong phòng trừ sâu chích hút?","Công thức phối hợp thuốc tiếp xúc lưu dẫn mạnh và lưu dẫn giúp tiêu diệt sâu chích hút hiệu quả nhờ tác động trực tiếp và thấm sâu vào cây trồng, đồng thời ngăn ngừa sâu phát triển kháng thuốc. Sự kết hợp này tăng cường hiệu quả phòng trừ và kéo dài thời gian bảo vệ cây trồng.","phac_do_sau_chich_hut","sau_chich_hut|cong_thuc_phoi_hop|thuoc_tiep_xuc|thuoc_luu_dan","Tác dụng của phối hợp thuốc tiếp xúc lưu dẫn mạnh và lưu dẫn là gì?|Tại sao phối hợp thuốc tiếp xúc và lưu dẫn lại hiệu quả cho sâu chích hút?"
nh_m_ch_ch_h_t_qa_03,"Có thể thay thuốc tiếp xúc lưu dẫn mạnh bằng thuốc nào khi phối hợp phòng trừ sâu chích hút?","Khi cần thay thuốc tiếp xúc lưu dẫn mạnh trong công thức phối hợp, có thể lựa chọn các thuốc có cùng phổ tác dụng và cơ chế lưu dẫn tương tự, đảm bảo hiệu quả diệt trừ sâu chích hút và hạn chế kháng thuốc. Việc thay thế cần tuân thủ hướng dẫn kỹ thuật và kiểm tra khả năng tương thích giữa các thuốc.","phac_do_sau_chich_hut","sau_chich_hut|thuoc_tiep_xuc|thay_the_thuoc|cong_thuc_phoi_hop","Có thể thay thuốc tiếp xúc lưu dẫn mạnh bằng thuốc nào?|Lựa chọn thuốc thay thế trong phối hợp thuốc phòng sâu chích hút?"
nh_m_ch_ch_h_t_qa_04,"Khi nào nên ưu tiên sử dụng thuốc lưu dẫn mạnh trong phác đồ phòng trừ sâu chích hút?","Ưu tiên sử dụng thuốc lưu dẫn mạnh khi sâu chích hút có mật độ cao, đặc biệt khi có hiện tượng kháng thuốc với các loại thuốc tiếp xúc thông thường. Thuốc lưu dẫn mạnh giúp thấm sâu vào mô cây, tiêu diệt sâu hiệu quả và hạn chế tái phát, đồng thời giảm thiểu nguy cơ kháng thuốc.","phac_do_sau_chich_hut","sau_chich_hut|thuoc_luu_dan_manh|mat_do_cao|khang_thuoc","Khi nào nên dùng thuốc lưu dẫn mạnh cho sâu chích hút?|Ưu điểm của thuốc lưu dẫn mạnh trong phòng trừ sâu chích hút là gì?"
nh_m_ch_ch_h_t_chunk_01,"Phác đồ phối hợp thuốc phòng trừ nhóm sâu chích hút như thế nào?","Đối tượng sâu hại là nhóm chích hút. Công thức phối hợp khuyến cáo gồm: Zigen Super 240ml + Nofara 240ml + bám dính 100ml pha với 200L nước, diệt trĩ hiệu quả đạt 80-90%. Ngoài ra, có thể dùng Oxatin 240ml + Nofara 240ml + bám dính 100ml/200L nước, hiệu quả diệt trĩ lên đến 90%. Đặc biệt với cây chè, sử dụng Igro Xpro liều 20ml/20L nước rất hiệu quả, đạt từ 80-90%, đã được thử nghiệm tại Thái Nguyên.","phac_do_sau_chich_hut","sau_chich_hut|phac_do|cong_thuc_phoi_hop|diet_tri|che","Phác đồ thuốc phòng trừ sâu chích hút là gì? | Công thức phối hợp thuốc diệt trĩ nhóm chích hút ra sao? | Thuốc nào dùng hiệu quả cho chè diệt trĩ? | Liều lượng phối trộn thuốc phòng trừ sâu chích hút?"
