id,question,answer,category,tags,alt_questions
nh_m_ch_ch_h_t_qa_01,"Khi phòng trừ sâu nhóm chích hút, công thức phối hợp thuốc Zigen Super và Nofara dùng như thế nào?","Công thức phối hợp gồm Zigen Super 240ml + Nofara 240ml + bám dính 100ml pha với 200L nước, sử dụng để diệt trĩ với hiệu quả từ 80-90%. Đây là công thức khuyến cáo cho nhóm sâu chích hút.","phac_do_sau_chich_hut","zigen_super|nofara|phac_do|diet_tri|sau_chich_hut","Cách dùng Zigen Super và Nofara phối hợp để diệt trĩ? | Liều lượng Zigen Super và Nofara trong phác đồ là bao nhiêu? | Công thức phối hợp thuốc diệt trĩ nhóm chích hút?"
nh_m_ch_ch_h_t_qa_02,"Oxatin phối hợp với Nofara và bám dính có hiệu quả diệt trĩ như thế nào?","Công thức phối hợp Oxatin 240ml + Nofara 240ml + bám dính 100ml pha với 200L nước cho hiệu quả diệt trĩ lên đến 90%, cao hơn so với công thức dùng Zigen Super. Đây là lựa chọn ưu tiên khi cần hiệu quả mạnh hơn trong phòng trừ sâu chích hút.","phac_do_sau_chich_hut","oxatin|nofara|diet_tri|phac_do|sau_chich_hut","Hiệu quả của Oxatin phối hợp Nofara và bám dính ra sao? | Liều lượng Oxatin và Nofara trong công thức phối hợp? | Có nên dùng Oxatin thay Zigen Super không?"
nh_m_ch_ch_h_t_qa_03,"Có thể thay đổi công thức thuốc khi phòng trừ sâu chích hút trên cây chè không?","Với cây chè, có thể sử dụng Igro Xpro liều 20ml/20L nước để phòng trừ sâu chích hút, đặc biệt là trĩ, đạt hiệu quả từ 80-90%. Công thức này đã được thử nghiệm thành công tại Thái Nguyên và là lựa chọn ưu tiên cho cây chè.","phac_do_sau_chich_hut","igro_xpro|che|diet_tri|phac_do|sau_chich_hut","Dùng thuốc nào hiệu quả cho chè diệt trĩ? | Liều lượng Igro Xpro cho cây chè là bao nhiêu? | Có thể thay thuốc trong phác đồ phòng trừ sâu chích hút không?"
nh_m_ch_ch_h_t_chunk_01,"Phác đồ phối hợp thuốc phòng trừ nhóm sâu chích hút như thế nào?","Đối tượng sâu hại là nhóm chích hút. Công thức phối hợp khuyến cáo là kết hợp thuốc Lekima để trừ toàn bộ trứng và con non của sâu. Việc sử dụng Lekima giúp kiểm soát hiệu quả các giai đoạn đầu của sâu chích hút, ngăn ngừa phát sinh sâu hại trên cây trồng.","phac_do_sau_chich_hut","nhom_chich_hut|cong_thuc_phoi_hop|thuoc_lekima|phong_tru_sau","Phác đồ phòng trừ sâu chích hút là gì?|Cách phối hợp thuốc để diệt trứng và con non sâu chích hút?|Có thể dùng thuốc nào để trừ sâu chích hút hiệu quả?|Lưu ý khi dùng Lekima để phòng trừ sâu chích hút?"
nh_m_ch_ch_h_t_qa_01,"Nhóm sâu chích hút nên dùng thuốc nào để diệt trứng và con non?","Đối với nhóm sâu chích hút, nên sử dụng thuốc Lekima để trừ toàn bộ trứng và con non, giúp kiểm soát sâu hại ngay từ giai đoạn đầu phát sinh.","phac_do_sau_chich_hut","nhom_chich_hut|thuoc_lekima|diet_trung_con_non","Nhóm sâu chích hút dùng thuốc gì để diệt trứng và con non?|Cách phòng trừ sâu chích hút hiệu quả là gì?"
nh_m_ch_ch_h_t_qa_02,"Có thể phối hợp thuốc nào để phòng trừ sâu chích hút hiệu quả?","Khuyến cáo phối hợp thuốc Lekima để phòng trừ sâu chích hút, đặc biệt là để diệt trứng và con non, giúp ngăn ngừa sâu phát triển và gây hại trên cây trồng.","phac_do_sau_chich_hut","phoi_hop_thuoc|nhom_chich_hut|diet_trung_con_non","Phối hợp thuốc nào để phòng trừ sâu chích hút?|Cách phối hợp thuốc Lekima để diệt sâu chích hút?"
nh_m_ch_ch_h_t_qa_03,"Lưu ý gì khi sử dụng Lekima để phòng trừ sâu chích hút?","Khi sử dụng Lekima để phòng trừ sâu chích hút, cần chú ý phun đúng liều lượng, thời điểm để đạt hiệu quả diệt trứng và con non tốt nhất, đồng thời tránh lạm dụng để hạn chế sâu kháng thuốc.","phac_do_sau_chich_hut","luu_y_su_dung|thuoc_lekima|phong_tru_sau","Lưu ý khi dùng Lekima để diệt sâu chích hút là gì?|Cần chú ý gì khi phun thuốc Lekima phòng trừ sâu chích hút?"
nh_m_mi_ng_nhai_chunk_01,"Phác đồ phối hợp thuốc phòng trừ nhóm sâu miệng nhai là gì?","Đối tượng sâu hại là nhóm miệng nhai. Công thức phối hợp khuyến cáo gồm Binhtox Gold, Oxatin, Voi Thai Gold liều 25-50ml kết hợp với Kajio 5WG 25g pha trong 20L nước. Phác đồ này giúp kiểm soát hiệu quả sâu miệng nhai trên cây trồng. Lưu ý sử dụng đúng liều lượng và pha trộn đều trước khi phun để đạt hiệu quả tối ưu.","phac_do_mieng_nhai","mieng_nhai|binhtox_gold|oxatin|voi_thai_gold|kajio_5wg|cong_thuc_phoi_hop","Phác đồ phòng trừ sâu miệng nhai gồm những thuốc nào?|Cách phối hợp thuốc Binhtox Gold và Kajio 5WG ra sao?|Liều lượng sử dụng thuốc cho nhóm sâu miệng nhai là bao nhiêu?|Lưu ý khi sử dụng phác đồ phối hợp thuốc cho sâu miệng nhai"
nh_m_mi_ng_nhai_qa_01,"Nhóm sâu miệng nhai nên dùng công thức phối hợp thuốc nào để phòng trừ?","Nhóm sâu miệng nhai nên sử dụng công thức phối hợp gồm Binhtox Gold, Oxatin, Voi Thai Gold với liều 25-50ml kết hợp Kajio 5WG 25g pha trong 20L nước để phòng trừ hiệu quả.","phac_do_mieng_nhai","mieng_nhai|binhtox_gold|oxatin|voi_thai_gold|kajio_5wg","Công thức thuốc nào hiệu quả cho sâu miệng nhai?|Phối hợp thuốc nào để diệt sâu miệng nhai?"
nh_m_mi_ng_nhai_qa_02,"Liều lượng và cách pha trộn thuốc Binhtox Gold, Oxatin, Voi Thai Gold với Kajio 5WG như thế nào?","Liều lượng thuốc Binhtox Gold, Oxatin, Voi Thai Gold là 25-50ml, phối hợp với Kajio 5WG 25g pha trong 20L nước. Pha trộn đều các thuốc trước khi phun để đảm bảo hiệu quả phòng trừ sâu miệng nhai.","phac_do_mieng_nhai","binhtox_gold|oxatin|voi_thai_gold|kajio_5wg|lieu_luong|pha_tron","Cách pha thuốc Binhtox Gold và Kajio 5WG ra sao?|Liều lượng thuốc phối hợp cho sâu miệng nhai là bao nhiêu?"
nh_m_mi_ng_nhai_qa_03,"Có lưu ý gì khi sử dụng công thức phối hợp thuốc cho nhóm sâu miệng nhai không?","Lưu ý sử dụng đúng liều lượng 25-50ml cho Binhtox Gold, Oxatin, Voi Thai Gold và 25g Kajio 5WG trên 20L nước, pha trộn đều trước khi phun. Không nên vượt quá liều để tránh gây hại cây trồng và môi trường. Thay đổi thuốc khi sâu có dấu hiệu kháng thuốc.","phac_do_mieng_nhai","luu_y|binhtox_gold|kajio_5wg|phoi_thuoc|mieng_nhai","Khi sử dụng phác đồ thuốc cho sâu miệng nhai cần lưu ý gì?|Có thể thay thuốc nào trong công thức phối hợp không?"
nh_m_mi_ng_nhai_chunk_01,"Phác đồ phối hợp thuốc phòng trừ nhóm sâu miệng nhai như thế nào?","Đối tượng sâu hại là nhóm sâu miệng nhai. Công thức phối hợp khuyến cáo gồm Binhtox Gold, Oxatin, Voi Thai Gold với liều lượng 25-50ml kết hợp với Bacillus 50gram pha trong 20L nước. Phác đồ này giúp kiểm soát hiệu quả sâu miệng nhai, đồng thời sử dụng Bacillus giúp tăng cường khả năng phòng trừ sinh học. Lưu ý điều chỉnh liều lượng thuốc phù hợp với mật độ sâu và điều kiện thực tế.","phac_do_mieng_nhai","mieng_nhai|binhtox_gold|oxatin|voi_thai_gold|bacillus|cong_thuc_phoi_hop","Phác đồ thuốc cho sâu miệng nhai là gì?|Cách phối hợp Binhtox Gold với Bacillus ra sao?|Liều lượng thuốc và nước trong phác đồ miệng nhai?|Có lưu ý gì khi dùng phác đồ phối hợp này?"
nh_m_mi_ng_nhai_qa_01,"Khi dùng phác đồ phối hợp Binhtox Gold, Oxatin, Voi Thai Gold với Bacillus cho nhóm sâu miệng nhai cần lưu ý gì?","Khi sử dụng phác đồ phối hợp Binhtox Gold, Oxatin, Voi Thai Gold với Bacillus cho nhóm sâu miệng nhai, cần pha đúng liều lượng 25-50ml thuốc với 50gram Bacillus trong 20L nước để đảm bảo hiệu quả. Lưu ý theo dõi mật độ sâu để điều chỉnh liều lượng phù hợp, tránh lạm dụng thuốc gây kháng thuốc hoặc ảnh hưởng đến môi trường.","phac_do_mieng_nhai","binhtox_gold|oxatin|voi_thai_gold|bacillus|luu_y|mieng_nhai","Lưu ý khi dùng phác đồ phối hợp thuốc cho sâu miệng nhai là gì?|Cách pha thuốc Binhtox Gold với Bacillus như thế nào?|Có cần điều chỉnh liều lượng khi dùng phác đồ này không?"
nh_m_mi_ng_nhai_qa_02,"Có thể thay thế thuốc nào trong phác đồ phối hợp Binhtox Gold, Oxatin, Voi Thai Gold với Bacillus không?","Phác đồ phối hợp Binhtox Gold, Oxatin, Voi Thai Gold với Bacillus được khuyến cáo sử dụng đồng thời để tăng hiệu quả phòng trừ nhóm sâu miệng nhai. Việc thay thế thuốc nên được cân nhắc kỹ dựa trên đặc tính thuốc và sâu hại, ưu tiên giữ Bacillus để duy trì hiệu quả sinh học. Thay thế thuốc hóa học cần tham khảo ý kiến chuyên gia để tránh giảm hiệu quả hoặc gây kháng thuốc.","phac_do_mieng_nhai","binhtox_gold|oxatin|voi_thai_gold|bacillus|thay_the_thuoc|mieng_nhai","Có thể thay thuốc nào trong phác đồ phối hợp không?|Thay thế Binhtox Gold bằng thuốc khác được không?|Vai trò của Bacillus trong phác đồ phối hợp là gì?"
nh_m_mi_ng_nhai_qa_03,"Tỷ lệ pha thuốc Binhtox Gold, Oxatin, Voi Thai Gold với Bacillus như thế nào để phòng trừ sâu miệng nhai?","Tỷ lệ pha thuốc trong phác đồ phối hợp là 25-50ml tổng lượng thuốc Binhtox Gold, Oxatin, Voi Thai Gold kết hợp với 50gram Bacillus trong 20L nước. Tỷ lệ này đảm bảo thuốc phát huy hiệu quả phòng trừ sâu miệng nhai đồng thời giữ an toàn cho cây trồng và môi trường.","phac_do_mieng_nhai","ty_le_pha_thuoc|binhtox_gold|oxatin|voi_thai_gold|bacillus|mieng_nhai","Tỷ lệ pha thuốc trong phác đồ phối hợp là bao nhiêu?|Cách pha thuốc Binhtox Gold với Bacillus đúng chuẩn?|Liều lượng thuốc và nước trong phác đồ phối hợp sâu miệng nhai?"
nh_m_mi_ng_nhai_chunk_01,"Phác đồ phối hợp thuốc phòng trừ nhóm sâu miệng nhai như thế nào?","Đối tượng sâu hại là nhóm sâu miệng nhai. Công thức phối hợp khuyến cáo: để diệt thêm trứng sâu và sâu non mới nở, cần bổ sung thuốc Tomi với liều lượng 40-50ml/20L nước. Lưu ý sử dụng đúng liều lượng để đạt hiệu quả phòng trừ tốt nhất.","phac_do_mieng_nhai","mieng_nhai|phac_do|cong_thuc_phoi_hop|tomi|diet_trung_sau","Phác đồ phòng trừ sâu miệng nhai là gì?|Cách phối hợp thuốc để diệt trứng sâu miệng nhai?|Liều lượng Tomi dùng để diệt sâu non mới nở?|Có lưu ý gì khi dùng Tomi phối hợp không?"
nh_m_mi_ng_nhai_qa_01,"Khi nào nên dùng thêm Tomi trong phác đồ phòng trừ nhóm sâu miệng nhai?","Khi muốn diệt thêm trứng sâu và sâu non mới nở trong nhóm sâu miệng nhai, nên bổ sung thuốc Tomi với liều 40-50ml/20L nước vào công thức phối hợp để tăng hiệu quả phòng trừ.","phac_do_mieng_nhai","mieng_nhai|tomi|diet_trung_sau|phac_do|cong_thuc_phoi_hop","Khi nào cần thêm Tomi trong phác đồ sâu miệng nhai?|Tại sao phải dùng Tomi để diệt trứng sâu?|Liều lượng Tomi dùng trong phác đồ là bao nhiêu?"
nh_m_mi_ng_nhai_qa_02,"Liều lượng Tomi dùng để diệt trứng sâu và sâu non mới nở là bao nhiêu?","Liều lượng Tomi khuyến cáo dùng để diệt trứng sâu và sâu non mới nở trong nhóm sâu miệng nhai là 40-50ml pha với 20L nước. Việc sử dụng đúng liều lượng giúp đạt hiệu quả phòng trừ cao và an toàn cho cây trồng.","phac_do_mieng_nhai","tomi|lieu_luong|mieng_nhai|diet_trung_sau|phac_do","Liều Tomi dùng để diệt trứng sâu là bao nhiêu?|Cách pha Tomi để diệt sâu non mới nở?|Tỷ lệ pha Tomi trong phác đồ sâu miệng nhai?"
nh_m_mi_ng_nhai_qa_03,"Có thể thay thế thuốc Tomi bằng thuốc nào khác khi diệt trứng sâu và sâu non mới nở không?","Thông tin hiện tại chỉ khuyến cáo sử dụng thuốc Tomi với liều 40-50ml/20L để diệt trứng sâu và sâu non mới nở trong nhóm sâu miệng nhai. Việc thay thế thuốc cần tham khảo thêm hướng dẫn chuyên môn hoặc khuyến cáo từ nhà sản xuất để đảm bảo hiệu quả và an toàn.","phac_do_mieng_nhai","tomi|thay_the|mieng_nhai|diet_trung_sau|phac_do","Có thể thay Tomi bằng thuốc khác không?|Thuốc thay thế Tomi để diệt trứng sâu là gì?|Lựa chọn thuốc khác khi không dùng Tomi như thế nào?"
nh_m_mi_ng_nhai_chunk_01,"Phác đồ phối hợp thuốc phòng trừ sâu nhóm miệng nhai như thế nào?","Đối tượng sâu hại là nhóm miệng nhai. Công thức phối hợp khuyến cáo là dùng liều thuốc như đối với sâu tơ hoặc tăng gấp 2 lần liều lượng. Ngoài ra, có thể cộng thêm Tomi với liều 50ml pha trong 20L nước để tăng hiệu quả phòng trừ. Lưu ý cần điều chỉnh liều lượng phù hợp với mật độ sâu và điều kiện thực tế.","phac_do_mieng_nhai","mieng_nhai|phac_do|cong_thuc_phoi_hop|tomi|lieu_luong","Phác đồ phòng trừ sâu miệng nhai là gì?|Cách phối hợp thuốc cho sâu nhóm miệng nhai như thế nào?|Liều lượng thuốc cho sâu miệng nhai ra sao?|Có thể dùng Tomi trong phác đồ sâu miệng nhai không?"
nh_m_mi_ng_nhai_qa_01,"Khi phòng trừ sâu nhóm miệng nhai, liều lượng thuốc nên dùng thế nào?","Khi phòng trừ sâu nhóm miệng nhai, nên dùng liều thuốc tương đương như đối với sâu tơ hoặc có thể tăng gấp 2 lần liều để đảm bảo hiệu quả. Việc tăng liều cần cân nhắc dựa trên mật độ sâu và điều kiện thực tế.","phac_do_mieng_nhai","mieng_nhai|lieu_luong|phac_do","Liều lượng thuốc cho sâu miệng nhai nên như thế nào?|Có nên tăng liều khi phòng trừ sâu miệng nhai không?|Liều dùng thuốc cho sâu nhóm miệng nhai là bao nhiêu?"
nh_m_mi_ng_nhai_qa_02,"Có thể phối hợp thuốc nào với công thức phòng trừ sâu nhóm miệng nhai?","Có thể phối hợp thêm thuốc Tomi với liều 50ml pha trong 20L nước vào công thức phòng trừ sâu nhóm miệng nhai để tăng hiệu quả. Việc phối hợp này giúp mở rộng phổ tác dụng và tăng khả năng kiểm soát sâu hại.","phac_do_mieng_nhai","mieng_nhai|tomi|cong_thuc_phoi_hop|phong_tru_sau","Phối hợp thuốc nào với công thức phòng trừ sâu miệng nhai?|Có thể dùng Tomi trong phác đồ sâu miệng nhai không?|Liều lượng Tomi khi phối hợp là bao nhiêu?"
nh_m_mi_ng_nhai_qa_03,"Lưu ý gì khi sử dụng phác đồ phối hợp thuốc cho sâu nhóm miệng nhai?","Lưu ý khi sử dụng phác đồ phối hợp thuốc cho sâu nhóm miệng nhai là cần điều chỉnh liều lượng phù hợp với mật độ sâu thực tế, có thể tăng gấp 2 lần liều so với sâu tơ. Ngoài ra, khi phối hợp thêm Tomi, cần đảm bảo pha đúng liều 50ml/20L nước để tránh gây độc hại cho cây trồng và môi trường.","phac_do_mieng_nhai","mieng_nhai|luu_y|tomi|lieu_luong|phoi_thuoc","Những lưu ý khi dùng phác đồ sâu miệng nhai là gì?|Cần chú ý gì khi phối hợp Tomi trong phác đồ?|Có nên tăng liều thuốc khi phòng trừ sâu miệng nhai không?"
nh_m_mi_ng_nhai_chunk_01,"Phác đồ phối hợp thuốc phòng trừ sâu miệng nhai như thế nào?","Đối tượng sâu hại là nhóm miệng nhai. Công thức phối hợp khuyến cáo gồm Binhtox Gold 50-100ml + Kajio 5EC 50ml + Tomi 50ml pha với 20L nước, phun khi sâu chui ra (thường vào sáng sớm hoặc tối khi tắt mặt trời). Hiệu quả đạt 70-90%. Để tăng hiệu quả, nên cộng thêm thuốc bám dính khi phun.","phac_do_mieng_nhai","mieng_nhai|phac_do|cong_thuc_phoi_hop|binhtox_gold|kajio_5ec|tomi","Phác đồ thuốc cho sâu miệng nhai là gì?|Cách phối hợp thuốc Binhtox Gold, Kajio 5EC và Tomi như thế nào?|Khi nào nên phun thuốc cho sâu miệng nhai?|Có lưu ý gì khi dùng phác đồ thuốc cho sâu miệng nhai?"
nh_m_mi_ng_nhai_qa_01,"Khi nào nên phun thuốc theo phác đồ Binhtox Gold + Kajio 5EC + Tomi để phòng trừ sâu miệng nhai?","Nên phun thuốc khi sâu miệng nhai chui ra, thường vào sáng sớm hoặc tối khi tắt mặt trời để đạt hiệu quả cao nhất.","phac_do_mieng_nhai","mieng_nhai|thoi_diem_phun|phac_do|binhtox_gold|kajio_5ec|tomi","Khi nào phun thuốc cho sâu miệng nhai theo phác đồ này?|Thời điểm phun thuốc hiệu quả cho sâu miệng nhai là gì?|Phun thuốc khi sâu miệng nhai xuất hiện lúc nào?"
nh_m_mi_ng_nhai_qa_02,"Tỷ lệ phối trộn thuốc Binhtox Gold, Kajio 5EC và Tomi trong phác đồ phòng trừ sâu miệng nhai là bao nhiêu?","Phối trộn gồm Binhtox Gold 50-100ml + Kajio 5EC 50ml + Tomi 50ml pha với 20L nước để phun.","phac_do_mieng_nhai","mieng_nhai|ty_le_phoi_tron|binhtox_gold|kajio_5ec|tomi|phac_do","Tỷ lệ thuốc trong phác đồ Binhtox Gold, Kajio 5EC, Tomi là gì?|Cách pha thuốc phòng trừ sâu miệng nhai như thế nào?|Liều lượng thuốc phối hợp cho sâu miệng nhai?"
nh_m_mi_ng_nhai_qa_03,"Có lưu ý gì khi sử dụng phác đồ phối hợp thuốc Binhtox Gold, Kajio 5EC và Tomi để phòng trừ sâu miệng nhai?","Lưu ý phun thuốc khi sâu chui ra, thường vào sáng sớm hoặc tối tắt mặt trời. Để tăng hiệu quả, nên cộng thêm thuốc bám dính khi phun.","phac_do_mieng_nhai","mieng_nhai|luu_y|binhtox_gold|kajio_5ec|tomi|bam_dinh","Lưu ý khi dùng phác đồ thuốc cho sâu miệng nhai là gì?|Có cần thêm thuốc bám dính khi phun không?|Khi nào phun thuốc để đạt hiệu quả cao nhất?"
nh_m_mi_ng_nhai_chunk_01,"Phác đồ phối hợp thuốc phòng trừ nhóm sâu miệng nhai như thế nào?","Đối tượng sâu hại là nhóm miệng nhai. Công thức phối hợp khuyến cáo là sử dụng công thức giống sâu tơ kết hợp với thuốc lưu dẫn nếu muốn diệt đồng thời sâu tơ và bọ nhảy. Lưu ý, thuốc lưu dẫn chỉ dùng khi cần kiểm soát cả hai loại sâu, giúp tăng hiệu quả phòng trừ.","phac_do_mieng_nhai","mieng_nhai|cong_thuc_phoi_hop|thuoc_luu_dan|sau_to|bo_nhay","phac_do phong tru nhom mieng nhai la gi|cong thuc phoi hop cho nhom mieng nhai nhu the nao|co nen dung thuoc luu dan khi diet sau to va bo nhay khong|huong dan su dung cong thuc phoi hop cho sau mieng nhai"
nh_m_mi_ng_nhai_qa_01,"Nhóm sâu miệng nhai nên dùng công thức thuốc nào để phòng trừ hiệu quả?","Nhóm sâu miệng nhai nên dùng công thức giống sâu tơ kết hợp với thuốc lưu dẫn nếu muốn diệt cả sâu tơ và bọ nhảy. Công thức này giúp kiểm soát đồng thời các đối tượng sâu hại trong nhóm miệng nhai.","phac_do_mieng_nhai","mieng_nhai|cong_thuc_phoi_hop|sau_to|bo_nhay","nhom sau mieng nhai dung cong thuc thuoc nao|phac do phong tru nhom mieng nhai la gi|cong thuc phoi hop cho nhom mieng nhai nhu the nao"
nh_m_mi_ng_nhai_qa_02,"Khi nào nên sử dụng thuốc lưu dẫn trong phác đồ phòng trừ nhóm miệng nhai?","Thuốc lưu dẫn nên được sử dụng trong phác đồ phối hợp khi cần diệt đồng thời sâu tơ và bọ nhảy. Nếu chỉ có sâu tơ thì có thể dùng riêng công thức giống sâu tơ mà không cần thêm thuốc lưu dẫn.","phac_do_mieng_nhai","thuoc_luu_dan|sau_to|bo_nhay|mieng_nhai","khi nao dung thuoc luu dan trong phong tru nhom mieng nhai|co nen dung thuoc luu dan khi chi co sau to khong|huong dan su dung thuoc luu dan trong phac do mieng nhai"
nh_m_mi_ng_nhai_qa_03,"Công thức giống sâu tơ phối hợp với thuốc lưu dẫn có ưu điểm gì?","Công thức phối hợp giữa thuốc giống sâu tơ và thuốc lưu dẫn giúp kiểm soát hiệu quả cả sâu tơ và bọ nhảy trong nhóm sâu miệng nhai, tăng hiệu quả phòng trừ sâu hại và giảm thiểu tổn thất cho cây trồng.","phac_do_mieng_nhai","cong_thuc_phoi_hop|sau_to|bo_nhay|mieng_nhai","uu diem cong thuc phoi hop giong sau to va thuoc luu dan|tac dung cua cong thuc phoi hop trong phong tru mieng nhai|tai sao phoi hop thuoc luu dan voi cong thuc sau to"
nh_m_mi_ng_nhai_qa_04,"Có thể thay thế thuốc lưu dẫn bằng loại thuốc nào khác trong phác đồ này không?","Thông tin không đề cập thuốc thay thế cụ thể cho thuốc lưu dẫn trong phác đồ phối hợp với công thức giống sâu tơ. Do đó, nên tuân thủ khuyến cáo sử dụng thuốc lưu dẫn để đảm bảo hiệu quả phòng trừ sâu hại.","phac_do_mieng_nhai","thuoc_luu_dan|phac_do|mieng_nhai|sau_to","co the thay the thuoc luu dan bang thuoc khac trong phac do mieng nhai khong|thuoc luu dan co the duoc thay the bang gi|huong dan thay the thuoc luu dan trong phac do mieng nhai"
nh_m_mi_ng_nhai_chunk_01,"Phác đồ phối hợp thuốc phòng trừ nhóm sâu miệng nhai như thế nào?","Đối tượng sâu hại là nhóm miệng nhai. Công thức phối hợp khuyến cáo là sử dụng Bipimai kết hợp với thuốc lưu dẫn và Abamectin 3.6 để phòng trừ sâu đục/trong. Nếu chỉ muốn diệt riêng bọ nhảy, có thể dùng riêng Abamectin 3.6. Lưu ý phối hợp đúng liều lượng và theo dõi mật độ sâu để đạt hiệu quả cao.","phac_do_mieng_nhai","mieng_nhai|bipimai|abamectin|luu_dan|phac_do|cong_thuc_phoi_hop","Phác đồ phòng trừ sâu miệng nhai gồm những thuốc nào? | Công thức phối hợp Bipimai và Abamectin dùng ra sao? | Khi nào nên dùng Abamectin riêng để diệt bọ nhảy? | Lưu ý khi phối hợp thuốc phòng sâu miệng nhai?"
nh_m_mi_ng_nhai_qa_01,"Nhóm sâu miệng nhai nên dùng công thức phối hợp thuốc nào để phòng trừ hiệu quả?","Nhóm sâu miệng nhai nên dùng công thức phối hợp Bipimai + thuốc lưu dẫn + Abamectin 3.6 để phòng trừ sâu đục/trong hiệu quả. Nếu chỉ muốn diệt riêng bọ nhảy, có thể dùng riêng Abamectin 3.6.","phac_do_mieng_nhai","mieng_nhai|bipimai|abamectin|luu_dan|phac_do","Nhóm sâu miệng nhai dùng thuốc gì để phòng trừ? | Công thức phối hợp thuốc cho sâu miệng nhai là gì? | Có thể dùng Abamectin riêng cho bọ nhảy không?"
nh_m_mi_ng_nhai_qa_02,"Có thể thay thế thuốc nào trong công thức Bipimai + Lưu dẫn + Abamectin 3.6 không?","Trong công thức phối hợp Bipimai + thuốc lưu dẫn + Abamectin 3.6, cần tuân thủ đúng liều lượng và thành phần để đảm bảo hiệu quả phòng trừ sâu miệng nhai. Việc thay thế thuốc cần được cân nhắc kỹ và tham khảo ý kiến chuyên gia để tránh giảm hiệu quả hoặc gây kháng thuốc.","phac_do_mieng_nhai","mieng_nhai|bipimai|abamectin|luu_dan|thay_the_thuoc","Có thể thay thuốc trong công thức Bipimai + Abamectin không? | Thay thế thuốc trong phác đồ sâu miệng nhai thế nào? | Lưu ý khi thay thuốc trong công thức phối hợp?"
nh_m_mi_ng_nhai_qa_03,"Khi nào nên ưu tiên dùng thuốc lưu dẫn trong phác đồ phòng trừ sâu miệng nhai?","Thuốc lưu dẫn được ưu tiên sử dụng trong phác đồ phối hợp với Bipimai và Abamectin 3.6 để tăng hiệu quả phòng trừ sâu miệng nhai, đặc biệt khi sâu đục/trong phát triển mạnh. Việc sử dụng thuốc lưu dẫn giúp thuốc thấm sâu và kéo dài thời gian bảo vệ cây trồng.","phac_do_mieng_nhai","mieng_nhai|luu_dan|bipimai|abamectin|phac_do","Khi nào dùng thuốc lưu dẫn trong phác đồ sâu miệng nhai? | Vai trò của thuốc lưu dẫn trong phối hợp thuốc? | Ưu tiên dùng lưu dẫn khi nào?"
nh_m_mi_ng_nhai_chunk_01,"Phác đồ phối hợp thuốc phòng trừ nhóm sâu miệng nhai là gì?","Đối tượng sâu hại là nhóm miệng nhai. Công thức phối hợp khuyến cáo là sử dụng Oxatin với liều lượng 30-40ml pha trong 25L nước, mang lại hiệu quả phòng trừ trên 90%. Lưu ý sử dụng đúng liều lượng để đạt hiệu quả tối ưu và tránh gây hại cho cây trồng.","phac_do_mieng_nhai","mieng_nhai|oxatin|phac_do|phong_tru_sau_hai","Phác đồ phòng trừ sâu miệng nhai là gì?|Cách dùng Oxatin để diệt sâu miệng nhai?|Liều lượng Oxatin pha với nước như thế nào?|Hiệu quả của Oxatin trên nhóm sâu miệng nhai ra sao?"
