id,question,answer,category,tags,alt_questions
nh_m_ch_ch_h_t_chunk_01,"Phác đồ phòng trừ nhóm sâu chích hút với mật độ bình thường bằng công thức lưu dẫn mạnh là gì?","Đối tượng sâu hại là nhóm sâu chích hút với mật độ xuất hiện bình thường. Công thức phối hợp khuyến cáo là sử dụng thuốc có tính lưu dẫn mạnh để đạt hiệu quả phòng trừ tốt nhất. Lưu ý khi áp dụng cần chọn thuốc phù hợp với nhóm sâu chích hút và tuân thủ đúng liều lượng, thời gian phun để tránh gây hại cho cây trồng và môi trường.","phac_do_sau_chich_hut","sau_chich_hut|mat_do_binh_thuong|luu_dan_manh|phac_do|cong_thuc_phoi_hop","Phòng trừ sâu chích hút mật độ bình thường bằng lưu dẫn mạnh|Cách dùng thuốc lưu dẫn mạnh cho sâu chích hút|Khi nào dùng lưu dẫn mạnh cho nhóm sâu chích hút|Công thức phối hợp thuốc cho sâu chích hút mật độ bình thường"
nh_m_ch_ch_h_t_qa_01,"Khi nhóm sâu chích hút xuất hiện với mật độ bình thường, nên dùng công thức phối hợp thuốc nào?","Khi nhóm sâu chích hút có mật độ bình thường, nên sử dụng công thức phối hợp thuốc có tính lưu dẫn mạnh để phòng trừ hiệu quả. Việc này giúp thuốc thấm sâu vào cây, diệt trừ sâu hại tận gốc và kéo dài thời gian bảo vệ.","phac_do_sau_chich_hut","sau_chich_hut|mat_do_binh_thuong|luu_dan_manh|phac_do","Nên dùng công thức nào cho sâu chích hút mật độ bình thường?|Phòng trừ sâu chích hút mật độ trung bình bằng thuốc lưu dẫn mạnh như thế nào?"
nh_m_ch_ch_h_t_qa_02,"Công thức lưu dẫn mạnh trong phòng trừ sâu chích hút có những lưu ý gì?","Công thức lưu dẫn mạnh cần lựa chọn thuốc có khả năng thấm sâu và lưu dẫn tốt trong cây, phù hợp với nhóm sâu chích hút. Cần tuân thủ đúng liều lượng và thời gian phun để tránh gây nhờn thuốc và bảo vệ môi trường. Có thể thay đổi thuốc trong nhóm lưu dẫn mạnh tùy theo điều kiện thực tế và loại cây trồng.","phac_do_sau_chich_hut","luu_dan_manh|sau_chich_hut|luu_y|phac_do","Lưu ý khi dùng công thức lưu dẫn mạnh cho sâu chích hút là gì?|Có thể thay thuốc lưu dẫn mạnh trong phác đồ sâu chích hút không?"
nh_m_ch_ch_h_t_qa_03,"Có thể thay thế thuốc lưu dẫn mạnh bằng loại thuốc nào khi phòng trừ sâu chích hút mật độ bình thường?","Có thể thay thế thuốc lưu dẫn mạnh bằng các thuốc có cơ chế tác động tương tự, có khả năng thấm sâu và lưu dẫn trong cây, phù hợp với nhóm sâu chích hút. Việc thay thế cần dựa trên đặc điểm sâu hại, loại cây trồng và điều kiện thực tế để đảm bảo hiệu quả và an toàn.","phac_do_sau_chich_hut","thay_thuoc|luu_dan_manh|sau_chich_hut|phac_do","Có thể thay thuốc lưu dẫn mạnh bằng thuốc nào khi phòng trừ sâu chích hút?|Thuốc thay thế cho lưu dẫn mạnh trong phác đồ sâu chích hút là gì?"
nh_m_ch_ch_h_t_chunk_01,"Phác đồ phối hợp thuốc phòng trừ nhóm sâu chích hút mật độ cao là gì?","Đối tượng sâu hại là nhóm chích hút với mật độ xuất hiện cao. Công thức phối hợp khuyến cáo gồm Exami 50gram và Binhfos 50ml pha trong 25L nước, đạt hiệu quả phòng trừ 90-95%. Lưu ý khi sử dụng cần đảm bảo pha đúng liều lượng và phun đều để đạt hiệu quả tối ưu.","phac_do_sau_hai","nhom_chich_hut|mat_do_cao|exami|binhfos|cong_thuc_phoi_hop","Phác đồ phòng trừ nhóm sâu chích hút mật độ cao là gì?|Cách phối hợp Exami và Binhfos để diệt sâu chích hút?|Liều lượng thuốc Exami và Binhfos trong phác đồ phối hợp?|Hiệu quả của công thức phối hợp Exami + Binhfos như thế nào?"
nh_m_ch_ch_h_t_qa_01,"Khi nhóm sâu chích hút có mật độ cao, nên dùng công thức phối hợp thuốc nào?","Khi nhóm sâu chích hút xuất hiện với mật độ cao, nên sử dụng công thức phối hợp Exami 50gram và Binhfos 50ml pha trong 25L nước để đạt hiệu quả phòng trừ từ 90-95%.","phac_do_sau_hai","nhom_chich_hut|mat_do_cao|exami|binhfos","Khi nào nên dùng Exami và Binhfos để phòng trừ sâu chích hút?|Công thức thuốc nào hiệu quả cho sâu chích hút mật độ cao?"
nh_m_ch_ch_h_t_qa_02,"Công thức phối hợp Exami và Binhfos pha như thế nào để đạt hiệu quả cao?","Công thức phối hợp gồm Exami 50gram và Binhfos 50ml pha trong 25L nước, phun đều lên cây trồng để đạt hiệu quả phòng trừ sâu chích hút từ 90-95%.","phac_do_sau_hai","exami|binhfos|cong_thuc_phoi_hop|mat_do_cao","Cách pha Exami và Binhfos để diệt sâu chích hút?|Tỷ lệ pha thuốc Exami và Binhfos trong 25L nước là bao nhiêu?"
nh_m_ch_ch_h_t_qa_03,"Có thể thay Binhfos bằng thuốc nào khác trong công thức phối hợp với Exami không?","Thông tin hiện tại không đề cập đến thuốc thay thế Binhfos trong công thức phối hợp với Exami. Để đảm bảo hiệu quả và an toàn, nên sử dụng đúng công thức khuyến cáo Exami 50gram + Binhfos 50ml/25L nước.","phac_do_sau_hai","binhfos|exami|thuoc_thay_the|phoi_hop","Có thể thay Binhfos bằng thuốc khác khi phối hợp với Exami không?|Lựa chọn thuốc thay thế Binhfos trong phác đồ phối hợp?"
nh_m_ch_ch_h_t_qa_04,"Lưu ý quan trọng khi sử dụng công thức phối hợp Exami và Binhfos để phòng trừ sâu chích hút là gì?","Lưu ý khi sử dụng công thức phối hợp Exami 50gram và Binhfos 50ml/25L nước là phải pha đúng liều lượng, phun đều trên diện tích cây trồng bị sâu chích hút, tránh phun khi trời mưa hoặc nắng gắt để đảm bảo hiệu quả tối ưu và hạn chế thuốc bị rửa trôi hoặc bay hơi.","phac_do_sau_hai","luu_y|exami|binhfos|phoi_hop|phun_thuoc","Những lưu ý khi dùng Exami và Binhfos phối hợp phòng trừ sâu chích hút?|Cách sử dụng thuốc phối hợp Exami và Binhfos hiệu quả?"
nh_m_ch_ch_h_t_chunk_01,"Phác đồ phối hợp thuốc phòng trừ nhóm sâu chích hút mật độ cao là gì?","Đối tượng sâu hại là nhóm chích hút với mật độ xuất hiện cao. Công thức phối hợp khuyến cáo gồm Sinapyram 30-50gram kết hợp với Binhfos 50ml pha trong 25L nước đạt độ đậm đặc 90% trở lên. Lưu ý cần đảm bảo pha đúng liều lượng và sử dụng khi mật độ sâu chích hút cao để đạt hiệu quả phòng trừ tối ưu.","phac_do_sau_chich_hut","sau_chich_hut|phac_do|cong_thuc_phoi_hop|sinapyram|binhfos","Phòng trừ sâu chích hút mật độ cao bằng công thức nào? | Công thức phối hợp Sinapyram và Binhfos dùng ra sao? | Khi nào nên dùng Sinapyram phối hợp Binhfos? | Liều lượng Sinapyram và Binhfos trong phác đồ là bao nhiêu?"
nh_m_ch_ch_h_t_qa_01,"Khi nhóm sâu chích hút mật độ cao, công thức phối hợp thuốc khuyến cáo là gì?","Khi nhóm sâu chích hút xuất hiện với mật độ cao, nên sử dụng công thức phối hợp Sinapyram 30-50gram cùng Binhfos 50ml pha trong 25L nước với độ đậm đặc 90% trở lên để phòng trừ hiệu quả.","phac_do_sau_chich_hut","sau_chich_hut|mat_do_cao|sinapyram|binhfos|phac_do","Công thức thuốc cho sâu chích hút mật độ cao là gì? | Dùng Sinapyram và Binhfos thế nào khi sâu chích hút nhiều? | Liều lượng phối hợp thuốc cho sâu chích hút cao?"
nh_m_ch_ch_h_t_qa_02,"Cách pha phối hợp Sinapyram và Binhfos để phòng trừ sâu chích hút mật độ cao?","Công thức phối hợp gồm Sinapyram 30-50gram và Binhfos 50ml được pha trong 25L nước, đảm bảo nước đạt độ đậm đặc 90% trở lên. Việc pha đúng liều lượng và tỷ lệ này giúp thuốc phát huy hiệu quả phòng trừ sâu chích hút mật độ cao.","phac_do_sau_chich_hut","sinapyram|binhfos|pha_thuoc|phac_do|sau_chich_hut","Pha Sinapyram và Binhfos thế nào để diệt sâu chích hút? | Tỷ lệ pha thuốc Sinapyram và Binhfos ra sao? | Hướng dẫn pha thuốc phòng sâu chích hút mật độ cao?"
nh_m_ch_ch_h_t_qa_03,"Có thể thay thế Binhfos bằng thuốc nào trong công thức phối hợp với Sinapyram không?","Thông tin không đề cập đến thuốc thay thế Binhfos trong công thức phối hợp với Sinapyram. Do đó, nên sử dụng đúng công thức Sinapyram 30-50gram và Binhfos 50ml để đảm bảo hiệu quả phòng trừ sâu chích hút mật độ cao.","phac_do_sau_chich_hut","binhfos|sinapyram|thuoc_thay_the|phac_do|sau_chich_hut","Có thuốc nào thay Binhfos trong công thức phối hợp không? | Thay Binhfos bằng thuốc khác được không? | Lựa chọn thuốc thay thế Binhfos khi phối hợp với Sinapyram?"
nh_m_ch_ch_h_t_qa_04,"Khi nào nên ưu tiên sử dụng công thức phối hợp Sinapyram và Binhfos để phòng trừ sâu chích hút?","Công thức phối hợp Sinapyram 30-50gram và Binhfos 50ml pha trong 25L nước với độ đậm đặc 90% trở lên nên được ưu tiên sử dụng khi mật độ sâu chích hút đạt mức cao, nhằm đảm bảo hiệu quả phòng trừ tối ưu và hạn chế thiệt hại cho cây trồng.","phac_do_sau_chich_hut","sau_chich_hut|sinapyram|binhfos|phac_do|mat_do_cao","Khi nào dùng công thức Sinapyram và Binhfos? | Ưu tiên dùng phối hợp thuốc khi nào? | Sử dụng công thức phối hợp trong điều kiện nào?"
nh_m_ch_ch_h_t_chunk_01,"Phác đồ phối hợp thuốc phòng trừ nhóm sâu chích hút với mật độ bình thường là gì?","Đối tượng sâu hại là nhóm chích hút với mật độ xuất hiện bình thường. Công thức phối hợp khuyến cáo gồm các phương pháp xông hơi hoặc tiếp xúc hoặc tiếp xúc-lưu dẫn kết hợp với toàn bộ thuốc lưu dẫn (bao gồm loại thường và mạnh). Lưu ý cần lựa chọn phương pháp phù hợp với điều kiện thực tế và tuân thủ liều lượng, thời gian cách ly để đảm bảo hiệu quả và an toàn.","phac_do_sau_chich_hut","sau_chich_hut|mat_do_binh_thuong|cong_thuc_phoi_hop|xong_hoi|tiep_xuc|luu_dan","Phác đồ phòng trừ sâu chích hút mật độ bình thường là gì?|Cách phối hợp thuốc cho sâu chích hút mật độ bình thường?|Sử dụng phương pháp nào để phòng trừ sâu chích hút mật độ vừa?|Lưu ý khi dùng thuốc lưu dẫn cho sâu chích hút mật độ bình thường?"
nh_m_ch_ch_h_t_qa_01,"Khi mật độ sâu chích hút bình thường, nên áp dụng công thức phối hợp thuốc nào?","Khi mật độ sâu chích hút ở mức bình thường, nên áp dụng công thức phối hợp gồm xông hơi hoặc tiếp xúc hoặc tiếp xúc-lưu dẫn kết hợp với toàn bộ các loại thuốc lưu dẫn (thường và mạnh) để đạt hiệu quả phòng trừ tốt nhất.","phac_do_sau_chich_hut","sau_chich_hut|mat_do_binh_thuong|cong_thuc_phoi_hop","Mật độ bình thường sâu chích hút dùng công thức nào?|Phòng trừ sâu chích hút mật độ vừa nên dùng thuốc gì?"
nh_m_ch_ch_h_t_qa_02,"Phương pháp xông hơi và tiếp xúc-lưu dẫn có thể phối hợp như thế nào để phòng trừ sâu chích hút?","Phương pháp xông hơi hoặc tiếp xúc-lưu dẫn có thể phối hợp với toàn bộ các loại thuốc lưu dẫn (bao gồm loại thường và mạnh) để tăng hiệu quả phòng trừ sâu chích hút nhóm chích hút với mật độ bình thường. Việc phối hợp này giúp thuốc thẩm thấu tốt và kéo dài thời gian bảo vệ.","phac_do_sau_chich_hut","xong_hoi|tiep_xuc_luu_dan|luu_dan|phoi_hop_thuoc","Cách phối hợp xông hơi và tiếp xúc-lưu dẫn cho sâu chích hút?|Có thể phối hợp xông hơi với thuốc lưu dẫn không?"
nh_m_ch_ch_h_t_qa_03,"Có thể thay thế thuốc lưu dẫn mạnh bằng thuốc nào khi phòng trừ sâu chích hút?","Thông thường, thuốc lưu dẫn mạnh có thể được thay thế bằng các loại thuốc lưu dẫn thường phù hợp với điều kiện thực tế và loại sâu hại. Tuy nhiên, cần đảm bảo thuốc thay thế có hiệu quả tương đương và tuân thủ hướng dẫn sử dụng để tránh giảm hiệu quả phòng trừ.","phac_do_sau_chich_hut","luu_dan_manh|thay_the_thuoc|phong_tru_sau_chich_hut","Có thể thay thuốc lưu dẫn mạnh bằng thuốc nào?|Thay thế thuốc lưu dẫn mạnh khi nào là hợp lý?"
nh_m_ch_ch_h_t_qa_04,"Khi nào nên ưu tiên sử dụng phương pháp tiếp xúc-lưu dẫn trong phòng trừ sâu chích hút?","Phương pháp tiếp xúc-lưu dẫn nên ưu tiên sử dụng khi sâu chích hút có mật độ bình thường và cần tăng cường hiệu quả phòng trừ lâu dài. Phương pháp này giúp thuốc lưu lại trên cây trồng lâu hơn, hạn chế sâu hại tái phát và giảm số lần phun thuốc.","phac_do_sau_chich_hut","tiep_xuc_luu_dan|uu_tien_su_dung|phong_tru_sau_chich_hut","Khi nào dùng tiếp xúc-lưu dẫn cho sâu chích hút?|Ưu điểm của tiếp xúc-lưu dẫn trong phòng trừ sâu chích hút là gì?"
nh_m_ch_ch_h_t_chunk_01,"Phác đồ phòng trừ nhóm sâu chích hút khi mật độ cao là gì?","Đối tượng sâu hại là nhóm chích hút với mật độ xuất hiện cao hơn. Công thức phối hợp khuyến cáo bao gồm sử dụng xông hơi mạnh kết hợp với toàn bộ lưu dẫn (bao gồm cả lưu dẫn thường và lưu dẫn mạnh) để đạt hiệu quả phòng trừ tối ưu. Lưu ý nên áp dụng đúng liều lượng và thời điểm xông hơi để đảm bảo hiệu quả và tránh gây hại cho cây trồng.","phac_do_sau_chich_hut","sau_chich_hut|mat_do_cao|cong_thuc_phoi_hop|xong_hoi|luu_dan","Phác đồ phòng trừ sâu chích hút mật độ cao là gì?|Khi sâu chích hút mật độ cao nên dùng công thức phối hợp nào?|Cách phối hợp xông hơi và lưu dẫn để diệt sâu chích hút?|Lưu ý khi sử dụng xông hơi mạnh và lưu dẫn trong phòng trừ sâu chích hút?"
nh_m_ch_ch_h_t_qa_01,"Khi mật độ sâu chích hút cao hơn, công thức phối hợp thuốc nào được khuyến cáo?","Khi mật độ sâu chích hút cao hơn, công thức phối hợp khuyến cáo là sử dụng xông hơi mạnh kết hợp với toàn bộ lưu dẫn, bao gồm cả lưu dẫn thường và lưu dẫn mạnh, nhằm tăng hiệu quả phòng trừ sâu hại.","phac_do_sau_chich_hut","sau_chich_hut|mat_do_cao|xong_hoi|luu_dan","Công thức phối hợp thuốc cho sâu chích hút mật độ cao là gì?|Nên dùng thuốc nào khi sâu chích hút xuất hiện mật độ cao?|Phối hợp xông hơi và lưu dẫn trong phòng trừ sâu chích hút như thế nào?"
nh_m_ch_ch_h_t_qa_02,"Công thức xông hơi mạnh phối hợp với lưu dẫn thường và mạnh có tác dụng gì trong phòng trừ sâu chích hút?","Công thức xông hơi mạnh phối hợp với toàn bộ lưu dẫn (thường và mạnh) giúp tiêu diệt sâu chích hút hiệu quả nhờ tác động trực tiếp và lưu dẫn thuốc sâu vào sâu hại, đặc biệt khi mật độ sâu cao, giúp kiểm soát sâu triệt để và hạn chế tái phát.","phac_do_sau_chich_hut","xong_hoi|luu_dan|phong_tru_sau|sau_chich_hut","Tác dụng của công thức xông hơi mạnh và lưu dẫn trong phòng trừ sâu chích hút?|Công thức phối hợp xông hơi và lưu dẫn có hiệu quả thế nào?|Tại sao nên dùng lưu dẫn mạnh khi sâu chích hút mật độ cao?"
nh_m_ch_ch_h_t_qa_03,"Có thể thay thế lưu dẫn mạnh bằng loại thuốc nào khi phối hợp với xông hơi mạnh để phòng trừ sâu chích hút?","Thông tin không đề cập đến thuốc thay thế cụ thể cho lưu dẫn mạnh trong công thức phối hợp với xông hơi mạnh. Tuy nhiên, khi cần có thể tham khảo các loại lưu dẫn khác có hiệu quả tương đương và phù hợp với nhóm sâu chích hút, đồng thời tuân thủ hướng dẫn sử dụng và an toàn.","phac_do_sau_chich_hut","luu_dan|thay_the|xong_hoi|sau_chich_hut","Có thể thay lưu dẫn mạnh bằng thuốc nào khi phối hợp với xông hơi mạnh?|Lưu ý khi thay thế lưu dẫn trong phác đồ phòng trừ sâu chích hút?|Thuốc lưu dẫn thay thế cho lưu dẫn mạnh là gì?"
nh_m_ch_ch_h_t_qa_04,"Khi nào nên ưu tiên sử dụng xông hơi mạnh kết hợp lưu dẫn trong phòng trừ sâu chích hút?","Ưu tiên sử dụng xông hơi mạnh kết hợp toàn bộ lưu dẫn khi mật độ sâu chích hút cao hơn nhằm tăng hiệu quả diệt trừ sâu, giảm thiểu tổn thất cho cây trồng và ngăn ngừa sâu phát triển mạnh trở lại.","phac_do_sau_chich_hut","xong_hoi|luu_dan|mat_do_cao|sau_chich_hut","Khi nào nên dùng xông hơi mạnh phối hợp lưu dẫn trong phòng trừ sâu chích hút?|Ưu tiên sử dụng công thức phối hợp nào khi sâu chích hút mật độ cao?|Lý do sử dụng xông hơi mạnh và lưu dẫn trong phòng trừ sâu chích hút?"
nh_m_ch_ch_h_t_chunk_01,"Phác đồ phối hợp thuốc phòng trừ nhóm sâu chích hút như thế nào?","Đối tượng sâu hại là nhóm sâu chích hút. Công thức phối hợp khuyến cáo là sử dụng thuốc có tác dụng tiếp xúc và lưu dẫn mạnh. Đặc biệt, với cây chè, thuốc Igro Xpro được đánh giá rất hiệu quả trong việc phòng trừ sâu chích hút. Lưu ý nên áp dụng đúng liều lượng và theo dõi mật độ sâu để đạt hiệu quả tối ưu.","phac_do_sau_hai","sau_chich_hut|tiep_xuc|luu_dan_manh|igro_xpro|phac_do","Phác đồ phòng trừ sâu chích hút là gì?|Cách phối hợp thuốc cho nhóm sâu chích hút?|Khi nào nên dùng Igro Xpro cho chè?|Thuốc lưu dẫn mạnh dùng cho sâu chích hút là gì?"
nh_m_ch_ch_h_t_qa_01,"Nhóm sâu chích hút nên dùng loại thuốc nào để phòng trừ hiệu quả?","Nhóm sâu chích hút nên dùng thuốc có tác dụng tiếp xúc và lưu dẫn mạnh để phòng trừ hiệu quả. Đặc biệt, với cây chè, thuốc Igro Xpro rất được khuyến cáo vì hiệu quả cao trong kiểm soát sâu hại.","phac_do_sau_hai","sau_chich_hut|thuoc_tiep_xuc|luu_dan_manh|igro_xpro","Thuốc nào hiệu quả cho sâu chích hút?|Có thuốc nào lưu dẫn mạnh cho sâu chích hút không?|Igro Xpro dùng cho nhóm sâu nào?"
nh_m_ch_ch_h_t_qa_02,"Có thể thay thuốc Igro Xpro bằng thuốc nào khác khi phòng trừ sâu chích hút trên chè?","Thông tin khuyến cáo chính xác là sử dụng Igro Xpro cho chè vì hiệu quả cao. Nếu cần thay thế, nên chọn các thuốc có tác dụng tiếp xúc và lưu dẫn mạnh tương đương, phù hợp với cây chè và theo hướng dẫn chuyên môn để đảm bảo hiệu quả và an toàn.","phac_do_sau_hai","igro_xpro|thuoc_thay_the|sau_chich_hut|phong_tru_sau","Có thể thay Igro Xpro bằng thuốc nào?|Thuốc thay thế Igro Xpro cho chè là gì?|Lựa chọn thuốc thay thế khi dùng Igro Xpro?"
nh_m_ch_ch_h_t_qa_03,"Khi nào nên ưu tiên sử dụng thuốc có tác dụng tiếp xúc và lưu dẫn mạnh cho nhóm sâu chích hút?","Ưu tiên sử dụng thuốc có tác dụng tiếp xúc và lưu dẫn mạnh khi mật độ sâu chích hút tăng cao, gây hại nghiêm trọng, hoặc khi sâu đã xâm nhập sâu vào cây trồng. Đặc biệt với cây chè, việc dùng Igro Xpro giúp kiểm soát sâu hiệu quả nhờ khả năng lưu dẫn và tiếp xúc tốt.","phac_do_sau_hai","tiep_xuc|luu_dan_manh|sau_chich_hut|muc_do_sau|igro_xpro","Khi nào dùng thuốc lưu dẫn mạnh cho sâu chích hút?|Ưu tiên dùng Igro Xpro khi nào?|Sử dụng thuốc tiếp xúc và lưu dẫn khi nào?"
nh_m_ch_ch_h_t_chunk_01,"Phác đồ phối hợp thuốc phòng trừ nhóm sâu chích hút như thế nào?","Đối tượng sâu hại là nhóm chích hút. Công thức phối hợp khuyến cáo bao gồm sử dụng thuốc tiếp xúc-lưu dẫn mạnh kết hợp với toàn bộ thuốc lưu dẫn (cả thường và mạnh) để đạt hiệu quả phòng trừ tối ưu. Lưu ý cần lựa chọn thuốc phù hợp với điều kiện canh tác và tuân thủ đúng liều lượng, thời gian cách ly để đảm bảo an toàn và hiệu quả.","phac_do_sau_chich_hut","nhom_chich_hut|phac_do|cong_thuc_phoi_hop|thuoc_luu_dan|thuoc_tiep_xuc","Phác đồ thuốc cho nhóm sâu chích hút là gì?|Cách phối hợp thuốc phòng trừ sâu chích hút?|Sử dụng thuốc tiếp xúc và lưu dẫn như thế nào để diệt sâu chích hút?|Lưu ý khi dùng thuốc cho nhóm sâu chích hút?"
nh_m_ch_ch_h_t_qa_01,"Nhóm sâu chích hút nên dùng công thức phối hợp thuốc nào để phòng trừ hiệu quả?","Nhóm sâu chích hút nên sử dụng công thức phối hợp thuốc bao gồm thuốc tiếp xúc-lưu dẫn mạnh kết hợp với toàn bộ thuốc lưu dẫn (thường và mạnh). Phối hợp này giúp tăng hiệu quả diệt trừ sâu và hạn chế sâu kháng thuốc.","phac_do_sau_chich_hut","nhom_chich_hut|cong_thuc_phoi_hop|thuoc_luu_dan|phong_tru_sau","Nhóm sâu chích hút dùng thuốc phối hợp nào hiệu quả?|Công thức phối hợp thuốc cho sâu chích hút là gì?"
nh_m_ch_ch_h_t_qa_02,"Có thể thay thế thuốc tiếp xúc-lưu dẫn mạnh bằng loại thuốc nào trong phác đồ cho sâu chích hút?","Trong phác đồ phòng trừ nhóm sâu chích hút, thuốc tiếp xúc-lưu dẫn mạnh có thể được thay thế bằng các loại thuốc có cơ chế tác động tương tự, đảm bảo tính tiếp xúc và lưu dẫn mạnh để duy trì hiệu quả. Tuy nhiên, cần tham khảo kỹ hướng dẫn sử dụng và khuyến cáo của nhà sản xuất để tránh giảm hiệu quả hoặc gây kháng thuốc.","phac_do_sau_chich_hut","nhom_chich_hut|thuoc_thay_the|phac_do|cong_thuc_phoi_hop","Có thể thay thuốc tiếp xúc-lưu dẫn mạnh bằng thuốc nào?|Thay thế thuốc trong phác đồ sâu chích hút như thế nào?"
nh_m_ch_ch_h_t_qa_03,"Khi nào nên ưu tiên sử dụng thuốc lưu dẫn mạnh trong phác đồ phòng trừ nhóm sâu chích hút?","Ưu tiên sử dụng thuốc lưu dẫn mạnh khi mật độ sâu chích hút cao hoặc khi sâu đã có dấu hiệu kháng thuốc với các loại thuốc lưu dẫn thường. Thuốc lưu dẫn mạnh giúp tăng khả năng thẩm thấu và kéo dài thời gian bảo vệ cây trồng, nâng cao hiệu quả phòng trừ.","phac_do_sau_chich_hut","nhom_chich_hut|thuoc_luu_dan_manh|phac_do|huong_dan_su_dung","Khi nào dùng thuốc lưu dẫn mạnh cho sâu chích hút?|Ưu tiên thuốc lưu dẫn mạnh trong phác đồ sâu chích hút khi nào?"
nh_m_ch_ch_h_t_chunk_01,"Phác đồ phối hợp thuốc phòng trừ nhóm sâu chích hút như thế nào?","Đối tượng sâu hại là nhóm chích hút. Công thức phối hợp khuyến cáo là có thể kết hợp thuốc Lekima để trừ toàn bộ trứng sâu, giúp kiểm soát hiệu quả sâu hại từ giai đoạn trứng. Lưu ý khi sử dụng cần đảm bảo liều lượng và thời điểm phun phù hợp để đạt hiệu quả tối ưu.","phac_do_sau_chich_hut","sau_chich_hut|cong_thuc_phoi_hop|lekima|phong_tru_sau|trung_sau","Phác đồ phòng trừ sâu chích hút là gì? | Cách phối hợp thuốc Lekima để trừ trứng sâu chích hút? | Khi nào nên dùng Lekima trong phác đồ sâu chích hút? | Có thể phối hợp Lekima với thuốc nào để phòng trừ sâu chích hút?"
nh_m_ch_ch_h_t_qa_01,"Nhóm sâu chích hút cần phối hợp thuốc như thế nào để phòng trừ hiệu quả?","Nhóm sâu chích hút nên được phòng trừ bằng cách phối hợp thuốc, trong đó có thể kết hợp Lekima để trừ toàn bộ trứng sâu. Việc phối hợp này giúp kiểm soát sâu hại từ giai đoạn trứng, giảm thiểu tổn thất cho cây trồng.","phac_do_sau_chich_hut","sau_chich_hut|lekima|phoi_hop_thuoc|phong_tru_sau","Phối hợp thuốc nào để phòng trừ sâu chích hút? | Lekima có tác dụng gì trong phác đồ sâu chích hút? | Làm sao để trừ trứng sâu chích hút hiệu quả?"
