id,question,answer,category,tags,alt_questions_v2
hariwon_30sl_chunk_01,"Hariwon 30SL là thuốc BVTV có thành phần gì và công dụng chính ra sao?","Hariwon 30SL là thuốc bảo vệ thực vật chứa hoạt chất Hymexazol 30% w/w, được đóng gói dưới dạng chai 30ml, 100ml và 240ml. Thuốc có công dụng điều hòa sinh trưởng, ngâm ủ hạt giống, và phòng trừ các bệnh nấm gây hại trên nhiều loại cây trồng như lúa (lúa von, thối gốc, héo rũ chết cây con), ớt, dưa hấu, dưa leo, hoa cúc, hoa hồng, khoai lang, khoai tây, khoai mì, cà chua, cà tím, mía, đậu nành, đậu xanh, dâu tây, thuốc lá, gừng, riềng, nghệ, củ cải, tỏi, đậu phộng, cà rốt, khoai sọ, hoa ly, khoai môn, hành, hồ tiêu, cà phê, sầu riêng, các loại cây ăn trái, thanh long, rau màu, bắp cải và bãi cỏ. Thuốc đặc biệt hiệu quả trong việc trừ nấm O trong đất như Pythium và Phytopthora, giúp xử lý nấm bệnh trong đất trước khi trồng trọt, ngăn ngừa thối gốc, thối rễ, héo rũ, héo vàng, chết cây con và các bệnh nấm khác. Có thể kết hợp với Metalaxyl, Dimethomorph hoặc Propamocarb để tăng hiệu quả trừ nấm. Không hiệu quả với nấm đất nhóm A, B.","thuoc_tru_benh","hymexazol|thuoc_tru_benh|nam_o|lua|rau_mau|cay_an_trai","Hariwon 30SL có thành phần gì và công dụng chính? | Thuốc Hariwon 30SL dùng để làm gì? | Thành phần và công dụng của Hariwon 30SL là gì?"
hariwon_30sl_chunk_02,"Cách sử dụng và liều lượng thuốc Hariwon 30SL như thế nào?","Hariwon 30SL được sử dụng để ngâm ủ hạt giống và xử lý đất trước khi trồng nhằm diệt trừ nấm bệnh trong đất cho mùa vụ tiếp theo. Liều lượng và cách dùng cụ thể tùy thuộc vào loại cây trồng và mục đích sử dụng, thường pha thuốc với nước theo hướng dẫn trên nhãn sản phẩm để ngâm hạt hoặc phun lên đất. Thuốc có thể kết hợp với các hoạt chất khác như Metalaxyl, Dimethomorph hoặc Propamocarb để tăng hiệu quả trừ nấm. Lưu ý không sử dụng thuốc trên các cây không được phép và tránh phun vào giai đoạn cây đang ra hoa hoặc thu hoạch để đảm bảo an toàn.","thuoc_tru_benh","huong_dan_su_dung|lieu_luong|nam_o|xu_ly_dat|ngam_hat","Cách dùng và liều lượng của Hariwon 30SL là gì? | Làm sao để sử dụng Hariwon 30SL hiệu quả? | Hướng dẫn sử dụng thuốc Hariwon 30SL như thế nào?"
hariwon_30sl_qa_01,"Hariwon 30SL dùng để phòng trừ bệnh gì trên cây lúa?","Hariwon 30SL dùng để điều hòa sinh trưởng, ngâm ủ hạt giống và phòng trừ các bệnh nấm gây hại trên cây lúa như lúa von, thối gốc, héo rũ và chết cây con. Thuốc giúp bảo vệ cây lúa từ giai đoạn hạt giống đến cây con, giảm thiểu tổn thất do nấm gây ra.","thuoc_tru_benh","lua|nam_o|hymexazol|thuoc_tru_benh|thoi_goc","Hariwon 30SL có tác dụng gì trên cây lúa? | Thuốc Hariwon 30SL trị bệnh gì cho lúa? | Dùng Hariwon 30SL cho cây lúa có hiệu quả không?"
hariwon_30sl_qa_02,"Có thể dùng Hariwon 30SL cho cây rau màu và cây ăn trái không?","Có, Hariwon 30SL được dùng cho nhiều loại rau màu và cây ăn trái để phòng trừ các bệnh nấm như thối gốc, thối rễ, héo rũ, vàng lá do úng ngập nước và các bệnh nấm rễ khác. Thuốc giúp bảo vệ bộ rễ và tăng sức đề kháng cho cây, thích hợp xử lý đất và ngâm hạt giống trước khi trồng.","thuoc_tru_benh","rau_mau|cay_an_trai|nam_o|thuoc_tru_benh|hymexazol","Hariwon 30SL có dùng được cho rau màu và cây ăn trái không? | Dùng Hariwon 30SL cho cây ăn trái có hiệu quả không? | Thuốc Hariwon 30SL có phù hợp với rau màu không?"
hariwon_30sl_qa_03,"Những lưu ý quan trọng khi sử dụng thuốc Hariwon 30SL là gì?","Khi sử dụng Hariwon 30SL cần lưu ý không phun thuốc lên cây trong giai đoạn ra hoa hoặc thu hoạch để tránh tồn dư thuốc trên sản phẩm. Không dùng thuốc cho các loại nấm đất nhóm A, B vì thuốc không hiệu quả với nhóm này. Nên kết hợp với các hoạt chất khác như Metalaxyl, Dimethomorph hoặc Propamocarb để tăng hiệu quả trừ nấm. Đảm bảo pha thuốc đúng liều lượng và sử dụng đúng quy cách để tránh gây hại cho cây trồng và môi trường.","thuoc_tru_benh","luu_y|an_toan|hymexazol|thuoc_tru_benh|ket_hop","Những lưu ý khi dùng Hariwon 30SL là gì? | Cần chú ý gì khi sử dụng Hariwon 30SL? | Lưu ý an toàn khi dùng thuốc Hariwon 30SL?"
toshiro_10ec_chunk_01,"Thuốc Toshiro 10EC có thành phần và công dụng chính là gì?","Toshiro 10EC là thuốc bảo vệ thực vật chứa hoạt chất Penconazole 10% w/w, được đóng gói dạng chai 240ml. Thuốc có tác dụng phòng trừ nhiều bệnh trên cây trồng như vàng lá, thối rễ, đốm lá trên sầu riêng; mốc sương trên khoai tây; héo vàng trên chuối; chết dây trên khoai lang; thối củ, đốm lá trên hành, tỏi, gừng, riềng, cà rốt; héo rủ, thối thân, mốc trắng, mốc xám, phấn trắng trên dưa hấu, bắp cải, dâu tây; đốm đen lá, phấn trắng trên hoa hồng; đạo ôn, khô vằn, thối thân, lem lép hạt trên lúa; ghẻ, sẹo trên cam, quýt; rỉ sắt trên cà phê; đốm mắt cua trên hoa cúc; thán thư trên điều, dưa hấu; muội đen, đốm nâu trên thuốc lá. Thuốc thuộc nhóm A với hiệu quả đặc biệt trên phấn trắng, ghẻ sẹo, và nhóm B trung bình, không có tác dụng nhóm O. Sản phẩm cạnh tranh với thuốc của công ty BMC.","thuoc_tru_benh","toshiro_10ec|penconazole_10%|thuoc_tru_benh|phong_tru_benh|sau_rieng|lua|cam_quyt","Thuốc Toshiro 10EC dùng để làm gì? | Thành phần và công dụng của Toshiro 10EC là gì? | Toshiro 10EC có tác dụng trên cây trồng nào? | Thuốc Toshiro 10EC chứa hoạt chất gì?"
toshiro_10ec_chunk_02,"Toshiro 10EC có những lưu ý quan trọng khi sử dụng không?","Khi sử dụng Toshiro 10EC, cần lưu ý không phun thuốc lên cây ngoài danh mục đã được khuyến cáo để tránh gây hại. Không dùng thuốc trong giai đoạn cây đang ra hoa hoặc quả non nếu không có hướng dẫn cụ thể. Nên tuân thủ liều lượng và cách dùng theo hướng dẫn kỹ thuật để đạt hiệu quả tối ưu và hạn chế kháng thuốc. Đặc biệt, tránh phun thuốc vào những ngày mưa hoặc nắng gắt để thuốc phát huy tác dụng tốt nhất.","thuoc_tru_benh","luu_y|an_toan|penconazole|thuoc_tru_benh|toshiro_10ec","Những lưu ý khi sử dụng Toshiro 10EC là gì? | Có cần chú ý gì khi phun Toshiro 10EC không? | Cách dùng an toàn thuốc Toshiro 10EC như thế nào?"
toshiro_10ec_qa_01,"Toshiro 10EC dùng để phòng trừ bệnh gì trên cây sầu riêng?","Toshiro 10EC phòng trừ các bệnh vàng lá, thối rễ và đốm lá trên cây sầu riêng hiệu quả nhờ hoạt chất Penconazole 10%.","thuoc_tru_benh","sau_rieng|vang_la|thoi_re|penconazole|thuoc_tru_benh","Toshiro 10EC có tác dụng gì trên cây sầu riêng? | Thuốc Toshiro 10EC trị bệnh nào trên sầu riêng? | Sử dụng Toshiro 10EC cho sầu riêng cần lưu ý gì?"
toshiro_10ec_qa_02,"Liều lượng và cách dùng Toshiro 10EC cho cây lúa như thế nào?","Liều lượng và cách dùng Toshiro 10EC cho cây lúa cần tuân thủ theo hướng dẫn kỹ thuật của nhà sản xuất, thường pha thuốc với nước theo tỷ lệ phù hợp và phun đều lên lá để phòng trừ các bệnh đạo ôn, khô vằn, thối thân và lem lép hạt. Nên phun vào giai đoạn lúa đang phát triển bệnh để đạt hiệu quả cao nhất.","thuoc_tru_benh","lua|dao_on|penconazole|thuoc_tru_benh|toshiro_10ec","Cách dùng Toshiro 10EC cho cây lúa ra sao? | Liều lượng phun Toshiro 10EC trên lúa là bao nhiêu? | Toshiro 10EC có hiệu quả trên bệnh đạo ôn lúa không?"
toshiro_10ec_qa_03,"Toshiro 10EC có tác dụng phòng trừ bệnh gì trên cây cam, quýt?","Toshiro 10EC phòng trừ bệnh ghẻ và sẹo trên cây cam, quýt nhờ hoạt chất Penconazole 10% với hiệu quả nhóm A đặc biệt.","thuoc_tru_benh","cam_quyt|ghe|seo|penconazole|thuoc_tru_benh|toshiro_10ec","Thuốc Toshiro 10EC trị bệnh gì trên cam, quýt? | Tác dụng của Toshiro 10EC trên cây cam, quýt là gì? | Có nên dùng Toshiro 10EC cho cam, quýt không?"
toshiro_10ec_qa_04,"Toshiro 10EC có hiệu quả như thế nào trên bệnh phấn trắng?","Toshiro 10EC thuộc nhóm A, có hiệu quả đặc biệt tốt trong việc phòng trừ bệnh phấn trắng trên nhiều loại cây trồng như dưa hấu, bắp cải, dâu tây, hoa hồng.","thuoc_tru_benh","phankhong|phankhong|penconazole|thuoc_tru_benh|toshiro_10ec","Toshiro 10EC có trị được bệnh phấn trắng không? | Hiệu quả của Toshiro 10EC trên bệnh phấn trắng ra sao? | Thuốc Toshiro 10EC dùng cho bệnh phấn trắng trên cây nào?"
kasuhan_4wp_tr_m_khu_n_chunk_01,"Kasuhan 4WP là thuốc bảo vệ thực vật có thành phần và công dụng như thế nào?","Kasuhan 4WP chứa hoạt chất Kasugamycin với nồng độ 40g/kg. Sản phẩm được đóng gói dưới dạng 100gr, 500gr và 1kg. Kasuhan 4WP đặc trị các bệnh do vi khuẩn trên nhiều loại cây trồng như lúa, cam, quýt, nhãn, xoài, hành, cà chua, bắp cải, nho, hoa hồng. Các bệnh được phòng trừ gồm bạc lá, đạo ôn, phấn trắng, vàng lá, thán thư, héo rũ, thối quả, thối nhũn, lở cổ rễ và thối gốc do vi khuẩn gây ra.","thuoc_tru_benh","kasugamycin|thuoc_tru_benh|khuan|lua|cam|quyt|nhan|xoai|hanh|ca_chua|bap_cai|nho|hoa_hong","Kasuhan 4WP có thành phần gì và dùng cho cây nào? | Thuốc Kasuhan 4WP dùng để trị bệnh gì trên cây trồng? | Quy cách đóng gói của Kasuhan 4WP là gì? | Kasuhan 4WP có đặc điểm nổi bật nào?"
kasuhan_4wp_tr_m_khu_n_chunk_02,"Kasuhan 4WP dùng để phòng trừ bệnh gì trên cây trồng và cách sử dụng như thế nào?","Kasuhan 4WP đặc trị các bệnh do vi khuẩn như bạc lá, đạo ôn, phấn trắng, vàng lá, thán thư, héo rũ, thối quả, thối nhũn, lở cổ rễ và thối gốc vi khuẩn trên nhiều loại cây trồng. Sản phẩm dùng phun đều lên cây trồng theo liều lượng hướng dẫn trên bao bì để đạt hiệu quả cao. Không phun thuốc khi cây đang ra hoa hoặc trong điều kiện thời tiết bất lợi để tránh ảnh hưởng đến cây trồng.","thuoc_tru_benh","kasugamycin|thuoc_tru_benh|benh_khuan|lua|cam|quyt|nhan|xoai|hanh|ca_chua|bap_cai|nho|hoa_hong","Kasuhan 4WP trị bệnh gì trên cây lúa? | Cách sử dụng Kasuhan 4WP cho cây cam và quýt? | Có lưu ý gì khi phun Kasuhan 4WP không?"
kasuhan_4wp_tr_m_khu_n_qa_01,"Kasuhan 4WP có thể dùng cho những loại cây trồng nào?","Kasuhan 4WP có thể dùng cho nhiều loại cây trồng như lúa, cam, quýt, nhãn, xoài, hành, cà chua, bắp cải, nho và hoa hồng để phòng trừ các bệnh do vi khuẩn gây ra.","thuoc_tru_benh","kasugamycin|lua|cam|quyt|nhan|xoai|hanh|ca_chua|bap_cai|nho|hoa_hong","Kasuhan 4WP dùng cho cây gì? | Những cây trồng nào phù hợp với Kasuhan 4WP? | Kasuhan 4WP có áp dụng cho cây hoa hồng không?"
kasuhan_4wp_tr_m_khu_n_qa_02,"Liều lượng và cách dùng Kasuhan 4WP như thế nào để đạt hiệu quả tốt?","Kasuhan 4WP được sử dụng bằng cách pha đúng liều lượng theo hướng dẫn trên bao bì và phun đều lên cây trồng khi có dấu hiệu bệnh hoặc phòng bệnh. Nên phun vào thời điểm cây khỏe, tránh phun khi cây đang ra hoa hoặc thời tiết mưa nhiều để đảm bảo hiệu quả và an toàn cho cây trồng.","thuoc_tru_benh","kasugamycin|lieu_luong|cach_dung|phun_thuoc|an_toan|lua|cam|quyt","Cách dùng Kasuhan 4WP hiệu quả? | Liều lượng phun Kasuhan 4WP cho cây lúa là bao nhiêu? | Có lưu ý gì khi sử dụng Kasuhan 4WP?"
kasuhan_4wp_tr_m_khu_n_qa_03,"Những lưu ý quan trọng khi sử dụng Kasuhan 4WP là gì?","Khi sử dụng Kasuhan 4WP cần tránh phun thuốc khi cây đang ra hoa hoặc trong điều kiện thời tiết mưa hoặc nắng gắt để tránh ảnh hưởng đến cây trồng. Ngoài ra, cần tuân thủ đúng liều lượng và quy trình phun để đạt hiệu quả phòng trừ bệnh tốt nhất và hạn chế kháng thuốc.","thuoc_tru_benh","kasugamycin|luu_y|an_toan|phun_thuoc|lua|cam|quyt","Những lưu ý khi dùng Kasuhan 4WP? | Có nên phun Kasuhan 4WP khi cây đang ra hoa không? | Làm sao để sử dụng Kasuhan 4WP an toàn và hiệu quả?"
shonam_500sc_chunk_01,"Shonam 500SC là thuốc bảo vệ thực vật có thành phần và công dụng gì?","Shonam 500SC chứa hoạt chất Fluazinam với nồng độ 500g/L, được đóng gói dạng chai 240ml. Thuốc có công dụng phòng trừ nhiều bệnh trên cây trồng như: nho bị mốc sương và phấn trắng; dưa hấu bị giả sương mai; lạc bị đốm lá; bắp cải bị sưng rễ; lúa bị đạo ôn và khô vằn. Thuốc rất mạnh với nhóm O, khá tốt với nhóm B và nhóm A, tuy nhiên hơi yếu với Pythium nên có thể kết hợp với Hymexazol khi tưới để tăng hiệu quả.","thuoc_tru_benh","fluazinam|thuoc_tru_benh|nho|dua_hau|lac|bap_cai|lua","Shonam 500SC dùng để phòng trừ bệnh gì trên cây nho? | Thành phần và công dụng của Shonam 500SC là gì? | Shonam 500SC có tác dụng trên cây trồng nào? | Liều lượng và cách dùng Shonam 500SC như thế nào?"
shonam_500sc_chunk_02,"Shonam 500SC có những đặc điểm nổi bật nào và sản phẩm đối thủ là gì?","Shonam 500SC nổi bật với khả năng phòng trừ rất mạnh nhóm bệnh O, khá mạnh với nhóm B và nhóm A như Botrytis, Alternaria, Sclerotinia. Tuy nhiên, thuốc hơi yếu với Pythium nên có thể kết hợp với Hymexazol khi tưới để tăng hiệu quả. Sản phẩm đối thủ tương tự gồm Banjo Forte của ADAMA và Nando 500SC của Nufarm.","thuoc_tru_benh","fluazinam|thuoc_tru_benh|nhom_o|botrytis|alternaria|sclerotinia","Shonam 500SC có điểm mạnh gì so với các thuốc khác? | Thuốc nào là đối thủ cạnh tranh của Shonam 500SC? | Có nên kết hợp Shonam 500SC với thuốc khác không?"
shonam_500sc_qa_01,"Shonam 500SC dùng để phòng trừ bệnh gì trên cây lúa?","Shonam 500SC dùng để phòng trừ các bệnh đạo ôn và khô vằn trên cây lúa, giúp bảo vệ cây khỏi các tác nhân gây hại phổ biến, từ đó nâng cao năng suất và chất lượng lúa.","thuoc_tru_benh","fluazinam|lua|dao_on|kho_van|thuoc_tru_benh","Shonam 500SC có tác dụng gì trên cây lúa? | Thuốc Shonam 500SC phòng bệnh nào cho lúa? | Cách dùng Shonam 500SC cho cây lúa như thế nào?"
shonam_500sc_qa_02,"Có thể sử dụng Shonam 500SC trên cây bắp cải để phòng bệnh gì?","Shonam 500SC được sử dụng để phòng trừ bệnh sưng rễ trên cây bắp cải, giúp cây phát triển khỏe mạnh và giảm thiểu thiệt hại do bệnh gây ra.","thuoc_tru_benh","fluazinam|bap_cai|sung_re|thuoc_tru_benh","Shonam 500SC có dùng được cho bắp cải không? | Thuốc Shonam 500SC trị bệnh gì trên bắp cải? | Liều lượng phun Shonam 500SC cho bắp cải?"
shonam_500sc_qa_03,"Khi sử dụng Shonam 500SC cần lưu ý gì để đạt hiệu quả cao?","Khi sử dụng Shonam 500SC, cần lưu ý thuốc hơi yếu với bệnh do Pythium gây ra nên có thể kết hợp với Hymexazol khi tưới để tăng hiệu quả phòng trừ. Ngoài ra, cần tuân thủ đúng liều lượng và thời điểm phun để tránh gây hại cho cây trồng và đảm bảo an toàn cho người sử dụng.","thuoc_tru_benh","fluazinam|luu_y|ket_hop|hymexazol|phun_thuoc","Những lưu ý khi dùng Shonam 500SC là gì? | Có cần kết hợp Shonam 500SC với thuốc khác không? | Làm sao để sử dụng Shonam 500SC hiệu quả nhất?"
topxim_pro_30sc_nh_n_nh_t_chunk_01,"Topxim pro 30SC là thuốc bảo vệ thực vật có đặc điểm gì nổi bật?","Topxim pro 30SC là thuốc BVTV chứa hoạt chất Kresoxim-Methyl 30% w/w, được đóng chai 240ml theo nhãn Nhật. Thuốc đặc trị các bệnh nấm như sương mai, đạo ôn, rỉ sắt (nấm cóc), đốm lá, đốm vàng, phấn trắng, mốc xám (nấm lông chuột), cháy lá, thán thư trên nhiều loại cây trồng như cây ăn trái, lúa, rau màu, cây công nghiệp. Sản phẩm này là giải pháp thay thế hiệu quả cho Chlorothalonil (Thalonil) – hoạt chất sẽ bị cấm sớm tại Việt Nam. Thuốc thuộc nhóm A về hiệu lực, khá hơn nhóm B và không có tác dụng nhóm O.","thuoc_tru_benh","topxim_pro_30sc|kresoxim_methyl|thuoc_tru_benh|nha_nhat|benh_nam|cay_an_tra|lua|rau_mau","Thuốc Topxim pro 30SC có công dụng gì? | Topxim pro 30SC dùng để phòng trừ bệnh nào? | Thành phần và quy cách của Topxim pro 30SC là gì? | Topxim pro 30SC có điểm gì nổi bật so với Chlorothalonil?"
topxim_pro_30sc_nh_n_nh_t_chunk_02,"Topxim pro 30SC dùng cho những loại cây trồng và bệnh nào?","Topxim pro 30SC được sử dụng để phòng trừ các bệnh nấm như sương mai, đạo ôn, rỉ sắt (nấm cóc), đốm lá, đốm vàng, phấn trắng, mốc xám (nấm lông chuột), cháy lá, thán thư trên cây ăn trái, lúa, rau màu và cây công nghiệp. Thuốc thích hợp cho nhiều loại cây trồng phổ biến, giúp bảo vệ cây khỏi các bệnh nấm gây hại nghiêm trọng.","thuoc_tru_benh","benh_nam|cay_an_tra|lua|rau_mau|cay_cong_nghiep|topxim_pro_30sc|kresoxim_methyl","Topxim pro 30SC dùng cho cây gì? | Thuốc có phòng trừ bệnh nào trên lúa? | Topxim pro 30SC có dùng được cho rau màu không? | Các bệnh chính thuốc Topxim pro 30SC đặc trị là gì?"
topxim_pro_30sc_nh_n_nh_t_qa_01,"Topxim pro 30SC có hoạt chất gì và nồng độ bao nhiêu?","Topxim pro 30SC chứa hoạt chất Kresoxim-Methyl với nồng độ 30% w/w, là hoạt chất có hiệu quả cao trong việc phòng trừ các bệnh nấm trên cây trồng.","thuoc_tru_benh","kresoxim_methyl|30%|thuoc_tru_benh|topxim_pro_30sc","Hoạt chất chính của Topxim pro 30SC là gì? | Nồng độ hoạt chất trong Topxim pro 30SC bao nhiêu? | Topxim pro 30SC chứa hoạt chất nào?"
topxim_pro_30sc_nh_n_nh_t_qa_02,"Quy cách đóng gói của Topxim pro 30SC như thế nào?","Topxim pro 30SC được đóng gói dưới dạng chai 240ml theo nhãn Nhật, thuận tiện cho việc sử dụng và bảo quản.","thuoc_tru_benh","quy_cach|chai_240ml|topxim_pro_30sc|thuoc_tru_benh","Topxim pro 30SC được đóng gói ra sao? | Quy cách bán của Topxim pro 30SC là gì? | Topxim pro 30SC có dung tích bao nhiêu?"
topxim_pro_30sc_nh_n_nh_t_qa_03,"Topxim pro 30SC có thể thay thế thuốc nào và vì sao?","Topxim pro 30SC là giải pháp thay thế hiệu quả cho thuốc Chlorothalonil (Thalonil), vì Chlorothalonil sẽ bị cấm sử dụng sớm tại Việt Nam. Topxim pro 30SC có hiệu lực mạnh nhóm A, vượt trội hơn nhóm B và không có tác dụng nhóm O, giúp kiểm soát tốt các bệnh nấm trên cây trồng.","thuoc_tru_benh","thay_the|chlorothalonil|topxim_pro_30sc|kresoxim_methyl|thuoc_tru_benh","Topxim pro 30SC thay thế thuốc nào? | Vì sao nên dùng Topxim pro 30SC thay cho Chlorothalonil? | Hiệu quả của Topxim pro 30SC so với Chlorothalonil ra sao?"
topxim_pro_30sc_nh_n_nh_t_qa_04,"Những lưu ý quan trọng khi sử dụng Topxim pro 30SC là gì?","Khi sử dụng Topxim pro 30SC cần tuân thủ đúng liều lượng và hướng dẫn của nhà sản xuất. Không phun thuốc vào giai đoạn cây đang ra hoa hoặc quả non để tránh ảnh hưởng đến năng suất và chất lượng. Tránh phun thuốc vào những ngày mưa hoặc có gió mạnh để đảm bảo hiệu quả và an toàn cho cây trồng. Ngoài ra, cần bảo hộ lao động đầy đủ khi phun thuốc để tránh tiếp xúc trực tiếp với hoạt chất.","thuoc_tru_benh","luu_y|an_toan|phun_thuoc|topxim_pro_30sc|kresoxim_methyl","Khi dùng Topxim pro 30SC cần lưu ý gì? | Có nên phun Topxim pro 30SC khi cây đang ra hoa không? | Cách bảo hộ khi sử dụng Topxim pro 30SC như thế nào?"
topxim_pro_30sc_nh_n_carbendazim_chunk_01,"Topxim pro 30SC (nhãn Carbendazim) là thuốc gì và có công dụng ra sao?","Topxim pro 30SC (nhãn Carbendazim) là thuốc bảo vệ thực vật chứa hoạt chất Kresoxim-Methyl 30% w/w, được đóng gói dưới dạng chai 240ml. Thuốc đặc trị các loại bệnh do nấm gây ra như sương mai, đạo ôn, rỉ sắt (nấm cóc), đốm lá, đốm vàng, phấn trắng, mốc xám (nấm lông chuột), cháy lá, thán thư trên nhiều loại cây trồng như cây ăn trái, lúa, rau màu và cây công nghiệp.","thuoc_tru_benh","topxim_pro_30sc|kresoxim_methyl_30%|thuoc_tru_benh|benh_nam|cay_an_tra|lua|rau_mau|cay_cong_nghiep","Thuốc Topxim pro 30SC dùng để làm gì? | Thuốc Topxim pro 30SC có thành phần gì? | Topxim pro 30SC dùng cho cây trồng nào? | Công dụng chính của Topxim pro 30SC là gì?"
topxim_pro_30sc_nh_n_carbendazim_chunk_02,"Topxim pro 30SC (nhãn Carbendazim) có những lưu ý gì khi sử dụng?","Khi sử dụng Topxim pro 30SC (nhãn Carbendazim), cần tuân thủ đúng liều lượng và hướng dẫn trên nhãn. Không phun thuốc khi cây đang ra hoa hoặc trong điều kiện thời tiết mưa to, gió lớn để tránh giảm hiệu quả. Tránh phun thuốc lên cây không thuộc đối tượng được phép để tránh gây hại. Đảm bảo bảo quản thuốc nơi khô ráo, tránh ánh nắng trực tiếp và xa tầm tay trẻ em.","thuoc_tru_benh","topxim_pro_30sc|luu_y_su_dung|bao_quan|an_toan_thuoc","Những lưu ý khi sử dụng Topxim pro 30SC là gì? | Cách bảo quản thuốc Topxim pro 30SC như thế nào? | Có nên phun thuốc khi cây đang ra hoa không?"
topxim_pro_30sc_nh_n_carbendazim_qa_01,"Topxim pro 30SC dùng để phòng trừ bệnh gì trên cây trồng?","Topxim pro 30SC chứa hoạt chất Kresoxim-Methyl 30% w/w, đặc trị các bệnh nấm như sương mai, đạo ôn, rỉ sắt (nấm cóc), đốm lá, đốm vàng, phấn trắng, mốc xám (nấm lông chuột), cháy lá và thán thư trên cây ăn trái, lúa, rau màu và cây công nghiệp.","thuoc_tru_benh","topxim_pro_30sc|benh_nam|kresoxim_methyl|cay_an_tra|lua|rau_mau","Topxim pro 30SC trị bệnh gì? | Thuốc Topxim pro 30SC có tác dụng gì? | Topxim pro 30SC dùng để phòng bệnh nào?"
topxim_pro_30sc_nh_n_carbendazim_qa_02,"Topxim pro 30SC được đóng gói như thế nào và nồng độ hoạt chất ra sao?","Topxim pro 30SC được đóng gói dưới dạng chai 240ml, chứa hoạt chất Kresoxim-Methyl với nồng độ 30% w/w, giúp đặc trị hiệu quả các bệnh nấm trên nhiều loại cây trồng.","thuoc_tru_benh","topxim_pro_30sc|kresoxim_methyl_30%|quy_cach|thuoc_tru_benh","Topxim pro 30SC có nồng độ hoạt chất bao nhiêu? | Quy cách đóng gói của Topxim pro 30SC là gì? | Thuốc Topxim pro 30SC chứa hoạt chất gì?"
topxim_pro_30sc_nh_n_carbendazim_qa_03,"Topxim pro 30SC có thể sử dụng cho những loại cây trồng nào?","Topxim pro 30SC thích hợp sử dụng cho nhiều loại cây trồng như cây ăn trái, lúa, rau màu và cây công nghiệp để phòng trừ các bệnh nấm phổ biến trên các loại cây này.","thuoc_tru_benh","topxim_pro_30sc|cay_an_tra|lua|rau_mau|cay_cong_nghiep|thuoc_tru_benh","Topxim pro 30SC dùng cho cây gì? | Thuốc Topxim pro 30SC có thể phun trên cây lúa không? | Topxim pro 30SC có dùng được cho rau màu không?"
topxim_pro_30sc_nh_n_carbendazim_qa_04,"Cần lưu ý gì khi sử dụng Topxim pro 30SC để đảm bảo an toàn và hiệu quả?","Khi sử dụng Topxim pro 30SC, người dùng cần tuân thủ đúng hướng dẫn về liều lượng và thời điểm phun, tránh phun thuốc khi cây đang ra hoa hoặc trong điều kiện thời tiết không thuận lợi như mưa hoặc gió lớn. Ngoài ra, cần bảo quản thuốc nơi khô ráo, tránh ánh nắng trực tiếp và xa tầm tay trẻ em để đảm bảo an toàn.","thuoc_tru_benh","topxim_pro_30sc|luu_y|an_toan|huong_dan_su_dung","Những lưu ý khi sử dụng Topxim pro 30SC là gì? | Làm sao để sử dụng Topxim pro 30SC an toàn? | Cách bảo quản thuốc Topxim pro 30SC như thế nào?"
